"","season","episode_num_in_season","episode_num_overall","Episode","patients_name","medical_diagnosis","icd_code","category","organs_affected","directed_by","written_by","us_viewers","original_air_date","imdb_rating","total_votes","description"
"73",2,22,44,"Forever","Kara Mason","Niacin deficiency [pellagra]","E52","NUTRITION","SKIN, BV, LIVER","Daniel Sackheim","Liz Friedman",24290000,"9 May 2006",8.1,2305,"A dad kisses his wife and baby goodbye before leaving for work, pukes and returns to find his wife with seizure in the bathtub and the baby under water. Foreman is back but changed."
"74",2,23,45,"Who's Your Daddy?","Leona","Zygomycosis","B46","INFECTIOUS","LUNGS","Martha Mitchell","Story by: Charles M. Duncan & John MankiewiczTeleplay by: John Mankiewicz & Lawrence Kaplow",22380000,"16 May 2006",7.8,2339,"House cares for a young Katrina victim, the alleged daughter of an old friend of his. He supposedly she had hallucinations because of the heart, but it turns out not to be the cause.House discovers a disease that his grandfather had."
"75",2,24,46,"No Reason","Gregory House","Other hallucinations","R442","PSYCHIATRIC","NS","David Shore","Story by: Lawrence Kaplow & David ShoreTeleplay by: David Shore",25470000,"23 May 2006",9.5,4835,"An old patient of House comes back and seeks revenge upon him in the form of gunshot."
"76",3,1,47,"Meaning","Richard McNeil","Hypothalamic dysfunction, not elsewhere classified","E233","NEUROLOGIC","NS","Deran Sarafian","Story by: Russel Friend & Garrett Lerner & Lawrence Kaplow & David ShoreTeleplay by: Lawrence Kaplow & David Shore",19550000,"5 Sep. 2006",8.9,2998,"Richard, a husband and father living with brain cancer, drives his wheelchair into a pool at a family BBQ. Everyone but his son think that it was suicide from the pain but House will stop at nothing to figure out his true ailment."
"77",3,1,47,"Meaning","Richard McNeil","Addisonian crisis","E272","GENITOURINARY","REN","Deran Sarafian","Story by: Russel Friend & Garrett Lerner & Lawrence Kaplow & David ShoreTeleplay by: Lawrence Kaplow & David Shore",19550000,"5 Sep. 2006",8.9,2998,"Richard, a husband and father living with brain cancer, drives his wheelchair into a pool at a family BBQ. Everyone but his son think that it was suicide from the pain but House will stop at nothing to figure out his true ailment."
"78",3,1,47,"Meaning","Caren Krause","Sequelae of vitamin C deficiency","E642","NUTRITION","GI","Deran Sarafian","Story by: Russel Friend & Garrett Lerner & Lawrence Kaplow & David ShoreTeleplay by: Lawrence Kaplow & David Shore",19550000,"5 Sep. 2006",8.9,2998,"Richard, a husband and father living with brain cancer, drives his wheelchair into a pool at a family BBQ. Everyone but his son think that it was suicide from the pain but House will stop at nothing to figure out his true ailment."
"79",3,2,48,"Cane and Able","Clancy Green","Chimera 46, XX/46, XY","Q990","OBSGYN","HEART, REN, NS","Daniel Sackheim","Story by: Russel Friend & Garrett Lerner & Lawrence Kaplow & David ShoreTeleplay by: Russel Friend & Garrett Lerner",15740000,"12 Sep. 2006",8.4,2434,"House is affected by the fact that he thinks he didn't solve the last case while a young boy, who believes aliens tortured him, is brought in."
"80",3,3,49,"Informed Consent","Ezra Powell","Amyloidosis of skin","L990","METABOLIC","SKIN","Laura Innes","David Foster",13670000,"19 Sep. 2006",8.6,2557,"House and his team face a lot of moral dilemmas when a patient wants them to help him end his life."
"81",3,4,50,"Lines in the Sand","Adam Kelvey","Unspecified parasitic disease","B89","INFECTIOUS","SPLEEN","Newton Thomas Sigel","David Hoselton",14520000,"26 Sep. 2006",9,3116,"A ten-year-old boy begins screaming in pain, but nobody knows why, because he is autistic and cannot explain. House refuses to use his office because it has new carpet."
"82",3,5,51,"Fools for Love","Tracy","Angioneurotic oedema","T783","VASCULAR","BV","David Platt","Peter Blake",14180000,"31 Oct. 2006",8.4,2311,"A husband and wife being treated cause Foreman to ponder the strength of true love, and House abuses one too many patients with potentially devastating repercussions."
"83",3,5,51,"Fools for Love","Jeremy","Angioneurotic oedema","T783","VASCULAR","BV","David Platt","Peter Blake",14180000,"31 Oct. 2006",8.4,2311,"A husband and wife being treated cause Foreman to ponder the strength of true love, and House abuses one too many patients with potentially devastating repercussions."
"84",3,6,52,"Que Será Será","George","Malignant neoplasm: Bronchus or lung, unspecified","C349","NEOPLASTIC","LUNG","Deran Sarafian","Thomas L. Moran",16110000,"7 Nov. 2006",8.1,2339,"An obese man in a coma presents treatment challenges, but finding out what's wrong with him may be the most challenging test of all. Elsewhere, Tritter ramps up his vendetta against House."
"85",3,7,53,"Son of Coma Guy","Kyle Wozniak","Other metabolic disorders","E88","METABOLIC","LIVER, BV","Dan Attias","Doris Egan",14600000,"14 Nov. 2006",8.9,2912,"When the son of a man in a vegetative state starts going into a coma, the vegetative man is reawakened chemically by House, who hopes to get some clues to the son's problems."
"86",3,8,54,"Whac-A-Mole","Jack Walters","Granulomatous disorders of skin and subcutaneous tissue","L92","METABOLIC","SKIN","Daniel Sackheim","Pamela Davis",15200000,"21 Nov. 2006",8.1,2232,"A young man collapses at his job, and House makes a game of establishing the diagnosis until things turn critical, and Tritter increases the pressure on Wilson."
"87",3,9,55,"Finding Judas","Alice Hartman","Hereditary erythropoietic porphyria","E800","METABOLIC","BONE MARROW","Deran Sarafian","Sara Hess",17300000,"28 Nov. 2006",8.5,2325,"While a little girl's life and limbs are in jeopardy, Tritter becomes more manipulative and House suffers withdrawal."
"88",3,10,56,"Merry Little Christmas","Abigail Ralphean","Multifocal and multisystemic (disseminated) Langerhans-cell histiocytosis [Letterer-Siwe disease]","C960","NEOPLASTIC","SKIN","Tony To","Liz Friedman",11770000,"12 Dec. 2006",8.7,2447,"Wilson presents the deal to House and then convinces Cuddy to back him up, meanwhile the team is flummoxed by a patient's condition and various members keep seeking out House for his opinion even though he may not be prepared to assist."
"89",3,11,57,"Words and Deeds","Derek Hoyt","Benign neoplasm: Spinal meninges","D321","NEOPLASTIC","NS","Daniel Sackheim","Leonard Dick",17780000,"9 Jan. 2007",8.6,2408,"House checks himself into rehab just before his trial, but a different game entirely may be afoot. Elsewhere, the team attempts to treat a firefighter who can't stop shivering."
"90",3,12,58,"One Day, One Room","Ear Patient","Foreign body in ear","T16","INFECTIOUS","EAR","Juan J. Campanella","David Shore",27340000,"30 Jan. 2007",9.1,4974,"Stuck with clinic duty, House almost wishes he had the boring patients back after he encounters a young woman with an STD and the need to talk."
"91",3,12,58,"One Day, One Room","Paciente","Tinea pedis","B353","INFECTIOUS","NOSE","Juan J. Campanella","David Shore",27340000,"30 Jan. 2007",9.1,4974,"Stuck with clinic duty, House almost wishes he had the boring patients back after he encounters a young woman with an STD and the need to talk."
"92",3,12,58,"One Day, One Room","Eve","Chlamydial infection of lower genitourinary tract","A560","INFECTIOUS","UG","Juan J. Campanella","David Shore",27340000,"30 Jan. 2007",9.1,4974,"Stuck with clinic duty, House almost wishes he had the boring patients back after he encounters a young woman with an STD and the need to talk."
"93",3,12,58,"One Day, One Room","Paciente","Foreign body in stomach","T182","GASTRO","GI","Juan J. Campanella","David Shore",27340000,"30 Jan. 2007",9.1,4974,"Stuck with clinic duty, House almost wishes he had the boring patients back after he encounters a young woman with an STD and the need to talk."
"94",3,13,59,"Needle in a Haystack","Stevie Lipa","Foreign body in colon","T184","GASTRO","GI","Peter O'Fallon","David Foster",24880000,"6 Feb. 2007",8,2266,"A young man is stricken during sex with his girlfriend, and House must determine why his organs are suddenly shutting down. Finding the cause is like looking for a needle in a haystack."
"95",3,14,60,"Insensitive","Hannah Morgenthal","Vitamin B deficiency, unspecified","E539","NUTRITION","GI","Deran Sarafian","Matthew V. Lewis",25990000,"13 Feb. 2007",8.8,2588,"On Valentine's Day, House meddles in relationships as he works to diagnose a teenager who has a genetic inability to feel pain."
"96",3,14,60,"Insensitive","Hannah Morgenthal","Taeniasis","B68","INFECTIOUS","GI","Deran Sarafian","Matthew V. Lewis",25990000,"13 Feb. 2007",8.8,2588,"On Valentine's Day, House meddles in relationships as he works to diagnose a teenager who has a genetic inability to feel pain."
"97",3,15,61,"Half-Wit","Patrick Obyedkov","Aortic arch syndrome [Takayasu]","M314","CONNECTIVE","BV","Katie Jacobs","Lawrence Kaplow",24400000,"6 Mar. 2007",9.1,3218,"House struggles to find out why a pianist savant is losing his ability to play. Ultimately, a decision must be made as to how much brain is necessary for a normal quality of life."
"98",3,16,62,"Top Secret","John Kelley","Hereditary haemorrhagic telangiectasia","I780","VASCULAR","BV","Deran Sarafian","Thomas L. Moran",20800000,"27 Mar. 2007",8.1,2268,"A patient whose relative has called in a favor with Cuddy presents with nonspecific minor symptoms that turn life-threatening, but House is distracted by a dream and an inability to urinate."
"99",3,17,63,"Fetal Position","Fetus","Hydrops fetalis due to other and unspecified haemolytic disease","P569","OBSGYN","heart""","Matt Shakman","Russel Friend & Garrett Lerner",20350000,"3 Apr. 2007",8.5,2458,"When a pregnant woman has a stroke, the team is at a loss after all tests reveal nothing, but when her organs start shutting down Cuddy takes over the case."
"100",3,17,63,"Fetal Position","Emma Sloan","Maternal care for hydrops fetalis","O362","OBSGYN","heart""","Matt Shakman","Russel Friend & Garrett Lerner",20350000,"3 Apr. 2007",8.5,2458,"When a pregnant woman has a stroke, the team is at a loss after all tests reveal nothing, but when her organs start shutting down Cuddy takes over the case."
"101",3,18,64,"Airborne","Fran","Toxic effect: Other specified gases, fumes and vapours","T598","METABOLIC","LUNGS, LIVER","Elodie Keene","David Hoselton",21570000,"10 Apr. 2007",9,2988,"House and Cuddy are flying back to the US from an international conference in Singapore. While en route a mysterious disease strikes one passenger and an epidemic unfolds, causing House to diagnose in midair since they have missed the halfway mark by passing the north pole. Back in Princeton, Wilson and House's lackeys have a confusing case of what is ailing a woman who came into the clinic and proceeded to have a seizure."
"102",3,18,64,"Airborne","Peng","Caisson disease [decompression sickness]","T703","RESP","LUNGS, BV","Elodie Keene","David Hoselton",21570000,"10 Apr. 2007",9,2988,"House and Cuddy are flying back to the US from an international conference in Singapore. While en route a mysterious disease strikes one passenger and an epidemic unfolds, causing House to diagnose in midair since they have missed the halfway mark by passing the north pole. Back in Princeton, Wilson and House's lackeys have a confusing case of what is ailing a woman who came into the clinic and proceeded to have a seizure."
"103",3,19,65,"Act Your Age","Jasper","Precocious puberty","E301","PEDIATRIC","UG","Daniel Sackheim","Sara Hess",22410000,"17 Apr. 2007",8.2,2208,"A young girl is ailed with diseases that usually strike people much older than her 6 years of age. But before House can diagnose her, her brother starts exhibiting the same symptoms she was admitted with. During all of this House gives Wilson tickets that a patient had given to him for a play. Ensuing a discussion on why men take women to plays. Wilson decides to take Cuddy and the tug of war with House for her affections begins, although Cuddy insists that she only went with Wilson as a friend."
"104",3,19,65,"Act Your Age","Lucy","Precocious puberty","E301","PEDIATRIC","UG","Daniel Sackheim","Sara Hess",22410000,"17 Apr. 2007",8.2,2208,"A young girl is ailed with diseases that usually strike people much older than her 6 years of age. But before House can diagnose her, her brother starts exhibiting the same symptoms she was admitted with. During all of this House gives Wilson tickets that a patient had given to him for a play. Ensuing a discussion on why men take women to plays. Wilson decides to take Cuddy and the tug of war with House for her affections begins, although Cuddy insists that she only went with Wilson as a friend."
"105",3,20,66,"House Training","Lupe","Sepsis due to Staphylococcus aureus","A410","INFECTIOUS","BV, NS, LIVER, REN","Paul McCrane","Doris Egan",20810000,"24 Apr. 2007",8.3,2256,"The cause of a woman's TIA stumps the team, and Foreman's family visits."
"106",3,21,67,"Family","Matty","Histoplasmosis","B39","INFECTIOUS","LIVER, SKIN, NS","David Straiton","Liz Friedman",21130000,"1 May 2007",8.4,2188,"Wilson is preparing his 14-year-old patient, Nick, for a bone marrow transplant when the donor, Nick's younger brother Matty, suddenly starts sneezing. Since Nick's immune system has been destroyed by the chemotherapy for his cancer, he cannot risk a marrow donation from Matty while Matty is ill. House decides that the fastest way to find out what's wrong with Matty is to make him worse. As the boys get sicker and sicker, House and his team race to cure Matty before both brothers die. Meanwhile, House battles Hector (his newly adopted dog) for supremacy and Foreman ..."
"107",3,22,68,"Resignation","Addie","Toxic effect of corrosive substances","T54","METABOLIC","LIVER, GI","Martha Mitchell","Pamela Davis",21360000,"8 May 2007",8.4,2216,"A college girl suddenly coughs up blood during karate class. Foreman resigns. A vegan couple has problems with floating poop. House secretly drugs Wilson with amphetamine."
"108",3,23,69,"The Jerk","Nate","Disorders of iron metabolism","E831","METABOLIC","LIVER, BV","Daniel Sackheim","Leonard Dick",21190000,"15 May 2007",8.5,2290,"When a teenage chess-player assaults his opponent, the team struggles to determine whether the problem is organic or psychological. Clinic Cases: Spotted sunburn."
"109",3,24,70,"Human Error","Marina Hernandez","Other heart disorders in diseases classified elsewhere","I52","HEART","heart""","Katie Jacobs","Thomas L. Moran & Lawrence Kaplow",17230000,"29 May 2007",8.9,2786,"A couple risk their lives getting from Cuba to see House, but his preoccupation with staff issues may cost the woman her life."
"110",3,24,70,"Human Error","Marina Hernandez","Other heart disorders in diseases classified elsewhere","I52","VASCULAR","heart""","Katie Jacobs","Thomas L. Moran & Lawrence Kaplow",17230000,"29 May 2007",8.9,2786,"A couple risk their lives getting from Cuba to see House, but his preoccupation with staff issues may cost the woman her life."
"111",4,1,71,"Alone","Liz Masters","Personal history of allergy to other antibiotic agents","Z881","ALLERGIC","LYMPH NODE","Deran Sarafian","Story by: Peter BlakeTeleplay by: Peter Blake & David Shore",14520000,"25 Sep. 2007",9,3099,"House is off his game without the team, and Wilson uses an extreme tactic to force him into interviews."
"112",4,1,71,"Alone","Liz Masters","Personal history of allergy to other antibiotic agents","Z881","ALLERGIC","liver","Deran Sarafian","Story by: Peter BlakeTeleplay by: Peter Blake & David Shore",14520000,"25 Sep. 2007",9,3099,"House is off his game without the team, and Wilson uses an extreme tactic to force him into interviews."
"113",4,1,71,"Alone","Liz Masters","Poisoning: Other and unspecified drugs, medicaments and biological substances","T509","METABOLIC","liver","Deran Sarafian","Story by: Peter BlakeTeleplay by: Peter Blake & David Shore",14520000,"25 Sep. 2007",9,3099,"House is off his game without the team, and Wilson uses an extreme tactic to force him into interviews."
"114",4,1,71,"Alone","Liz Masters","Withdrawal state with delirium","F104","PSYCHIATRIC","NS","Deran Sarafian","Story by: Peter BlakeTeleplay by: Peter Blake & David Shore",14520000,"25 Sep. 2007",9,3099,"House is off his game without the team, and Wilson uses an extreme tactic to force him into interviews."
"115",4,1,71,"Alone","Liz Masters","Poisoning: Oral contraceptives","T384","METABOLIC","liver","Deran Sarafian","Story by: Peter BlakeTeleplay by: Peter Blake & David Shore",14520000,"25 Sep. 2007",9,3099,"House is off his game without the team, and Wilson uses an extreme tactic to force him into interviews."
"116",4,2,72,"The Right Stuff","Greta Cooper","Other phakomatoses, not elsewhere classified","Q858","OBSGYN","NS, HEART, REN, LUNGS","Deran Sarafian","Doris Egan & Leonard Dick",17440000,"2 Oct. 2007",8.8,2714,"House is forced to choose a new staff... and gathers 40 applicants to start narrowing down the field. Meanwhile, an Air Force pilot wants House to treat her secretly so she doesn't ruin her chances of becoming an astronaut."
"117",4,3,73,"97 Seconds","Thomas Stark","Ancylostomiasis","B760","INFECTIOUS","GI","David Platt","Russel Friend & Garrett Lerner",18030000,"9 Oct. 2007",8.8,2533,"Down to 10 candidates for his team, House splits them into 2 groups to diagnose a patient whose short lifespan has been made even shorter. Foreman leads his own team to diagnose a patient at his new workplace."
"118",4,4,74,"Guardian Angels","Irene","Poisoning: Alpha-adrenoreceptor antagonists, not elsewhere classified","T446","METABOLIC","LIVER, NS","Deran Sarafian","David Hoselton",18100000,"23 Oct. 2007",8.5,2299,"A woman seeing her dead mother stumps the recruits, especially once she begins seeing a recent victim."
"119",4,5,75,"Mirror Mirror","Robert Elliot","Zoonotic bacterial disease, unspecified","A289","INFECTIOUS","LYMPH NODE","David Platt","David Foster",17290000,"30 Oct. 2007",8.8,2652,"A victim of a mugging presents with neurological symptoms and begins to mirror the behaviors of his doctors. Foreman joins the new fellows in seeking a diagnosis; Cameron and Chase takes bets on whom House will fire next."
"120",4,6,76,"Whatever It Takes","Casey Alfonso","Heatstroke and sunstroke","T670","NEUROLOGIC","NS","Juan J. Campanella","Story by: Thomas L. MoranTeleplay by: Thomas L. Moran & Peter Blake",18170000,"6 Nov. 2007",8.6,2407,"House is taken by jet to help diagnose a dying CIA agent, leaving Foreman in charge of the team trying to find out why a young woman passed out after a drag car race."
"121",4,6,76,"Whatever It Takes","Casey Alfonso","Toxic effect: Other metals","T568","METABOLIC","liver","Juan J. Campanella","Story by: Thomas L. MoranTeleplay by: Thomas L. Moran & Peter Blake",18170000,"6 Nov. 2007",8.6,2407,"House is taken by jet to help diagnose a dying CIA agent, leaving Foreman in charge of the team trying to find out why a young woman passed out after a drag car race."
"122",4,6,76,"Whatever It Takes","John","Toxic effect: Other specified inorganic substances","T578","METABOLIC","liver","Juan J. Campanella","Story by: Thomas L. MoranTeleplay by: Thomas L. Moran & Peter Blake",18170000,"6 Nov. 2007",8.6,2407,"House is taken by jet to help diagnose a dying CIA agent, leaving Foreman in charge of the team trying to find out why a young woman passed out after a drag car race."
"123",4,7,77,"Ugly","Kenny","Lyme disease","A692","INFECTIOUS","NS, HEART","David Straiton","Sean Whitesell",16950000,"13 Nov. 2007",8.3,2302,"House and his team are hampered by a reality television crew whilst battling over possible diagnoses for a craniofacial surgery patient."
"124",4,8,78,"You Don't Want to Know","Flynn","Lupus erythematosus","L93","AUTOIMMUNE","SKIN","Lesli Linka Glatter","Sara Hess",16880000,"20 Nov. 2007",8.6,2300,"A magician's heart stops during a performance. At first House dismisses the case, but later changes his mind when complications arise. House has a contest to determine the next one to leave the team."
"125",4,9,79,"Games","Jimmy Quidd","Measles","B05","INFECTIOUS","SKIN","Deran Sarafian","Eli Attie",16960000,"27 Nov. 2007",8.6,2435,"House treats a rock musician, and some of the candidates have to get past their personal biases, Wilson misdiagnoses a patient, and the winners are named."
"126",4,10,80,"It's a Wonderful Lie","Maggie","Neoplasm of uncertain or unknown behaviour: Breast","D486","NEOPLASTIC","BREAST","Matt Shakman","Pamela Davis",22560000,"29 Jan. 2008",8.4,2234,"House is equally obsessed with a mother and daughter who don't lie, and using Christmas to create discord among the team members."
"127",4,11,81,"Frozen","Dr. Cate Milton","Pulmonary embolism","I26","VASCULAR","LUNG","David Straiton","Liz Friedman",29040000,"3 Feb. 2008",9.2,3296,"When a researcher at a South Pole base becomes ill, House must diagnose the case at a distance. Meanwhile, House tries to find out who Wilson is dating, and his new staff tries to get him cable."
"128",4,12,82,"Don't Ever Change","Roz","Other specified disorders of kidney and ureter","N288","GENITOURINARY","REN","Deran Sarafian","Doris Egan & Leonard Dick",23150000,"5 Feb. 2008",8.1,2201,"A woman collapses at her wedding. She led a different life style before her marriage, House insists she hasn't changed. Wilson starts dating Amber."
"129",4,13,83,"No More Mr. Nice Guy","Jeff","Chagas disease","B57","INFECTIOUS","GI, HEART, NS","Deran Sarafian","David Hoselton & David Shore",14510000,"28 Apr. 2008",8.1,2114,"House encounters a patient who is too nice for his own good, which is a bigger problem than his emergency room diagnosis; and House competes with Amber for Wilson's attention."
"130",4,14,84,"Living the Dream","Evan Greer","Personal history of allergy to other drugs, medicaments and biological substances","Z888","ALLERGIC","liver","David Straiton","Sara Hess & Liz Friedman",13260000,"5 May 2008",8.3,2196,"House finds himself at odds with his team when he becomes convinced that an actor on his favorite soap, ""Prescription Passion,"" has a serious medical condition."
"131",4,15,85,"House's Head","Bus driver","Air embolism following infusion, transfusion and therapeutic injection","T800","VASCULAR","BV","Greg Yaitanes","Story by: Doris EganTeleplay by: Peter Blake & David Foster & Russel Friend & Garrett Lerner",14840000,"12 May 2008",9.8,9318,"A bus that House was riding crashes. House claims there's a victim on the bus who is dying, but not from the bus accident. He stops at nothing to figure out who the patient is and what is ailing him/her."
"132",4,16,86,"Wilson's Heart","Amber Volakis","Poisoning by antiepileptic, sedative-hypnotic and antiparkinsonism drugs","T42","METABOLIC","NS, LIVER","Katie Jacobs","Peter Blake, David Foster, Russel Friend & Garrett Lerner",16160000,"19 May 2008",9.8,8768,"The team works to save someone close to a central character's heart. The key is inside House's head, but he is in a bad way himself."
"133",5,1,87,"Dying Changes Everything","Lou","Lepromatous leprosy","A305","INFECTIOUS","SKIN","Deran Sarafian","Eli Attie",14770000,"16 Sep. 2008",8.4,2471,"House's preoccupation with Wilson leaves his team without direction and endangers the patient, a female whose exhaustive work schedule and demanding boss may have caused her condition."
"134",5,2,88,"Not Cancer","Apple","Malignant neoplasm, without specification of site","C80","NEOPLASTIC","BONES","David Straiton","David Shore & Lawrence Kaplow",12370000,"23 Sep. 2008",8.2,2185,"Years after receiving body parts from an organ donor, five out of six recipients die within a few months, but not from organ rejection. House and the team race against time to figure out why before the final surviving recipient, a young woman who received the donor's cornea, mysteriously dies as well. House retains a comical private investigator to investigate patients, doctors, and his estranged friend, Wilson."
"135",5,2,88,"Not Cancer","Apple","Malignant neoplasm, without specification of site","C80","NEOPLASTIC","BONE","David Straiton","David Shore & Lawrence Kaplow",12370000,"23 Sep. 2008",8.2,2185,"Years after receiving body parts from an organ donor, five out of six recipients die within a few months, but not from organ rejection. House and the team race against time to figure out why before the final surviving recipient, a young woman who received the donor's cornea, mysteriously dies as well. House retains a comical private investigator to investigate patients, doctors, and his estranged friend, Wilson."
"136",5,3,89,"Adverse Events","Brandon","Foreign body in stomach","T182","GASTRO","GI","Andrew Bernstein","Carol Green & Dustin Paddock",12970000,"30 Sep. 2008",8.1,2081,"House's investigator gets information on everyone, which House uses to stir the pot of their lives while the team tries to cure a portraitist whose artistic view now looks like Picasso."
"137",5,4,90,"Birthmarks","Nicole","Foreign body or object entering through skin","W45","NEUROLOGIC","SKIN, NS","David Platt","Doris Egan & David Foster",13260000,"14 Oct. 2008",9,2757,"House tries every delaying tactic available when Wilson forces him to attend his father's funeral. Meanwhile, the team tries to find the cause of a young woman's abdominal pain and hemorrhage that occurred in China."
"138",5,5,91,"Lucky Thirteen","Spencer","Sicca syndrome [Sjögren]","M350","AUTOIMMUNE",NA,"Greg Yaitanes","Liz Friedman & Sara Hess",13080000,"21 Oct. 2008",8.5,2365,"Thirteen's one night stand collapses at her apartment, and her symptoms are so misleading that the diagnosis may be terminal. Meanwhile, revelation about Wilson and Thirteen occupy House."
