"","season","episode_num_in_season","episode_num_overall","Episode","patients_name","medical_diagnosis","icd_code","category","organs_affected","directed_by","written_by","us_viewers","original_air_date","imdb_rating","total_votes","description"
"199",7,5,137,"Unplanned Parenthood","Kayla","Melanoma in situ","D03","NEOPLASTIC","SKIN","Greg Yaitanes","David Foster",9650000,"18 Oct. 2010",8.2,1918,"A newborn baby has problems breathing. House and team run diagnosis. House babysits Cuddy's daughter. Did she eat a dime? Foreman finds a new female doctor for the team. House fires her and Taub has to find a new one."
"200",7,6,138,"Office Politics","Joe Dugan","Acute hepatitis C","B171","INFECTIOUS","liver","Sanford Bookstaver","Seth Hoffman",9630000,"8 Nov. 2010",8.1,1830,"It's election season, and in the midst of a tight campaign, an incumbent New Jersey senator's campaign manager falls ill with liver failure and temporary paralysis. Cuddy pushes House to add a female doctor to his team by hiring brilliant third-year medical student Martha Masters in Thirteen's absence. House and the team are wary of the young doctor's lack of experience and medical perspective, but are forced to give their new by-the-book teammate a chance to prove herself. After the campaigning senator makes a surprising announcement, House and the team look to the ..."
"201",7,7,139,"A Pox on Our House","Julie","Rickettsialpox due to Rickettsia akari","A791","INFECTIOUS","BV","Tucker Gates","Lawrence Kaplow",10770000,"15 Nov. 2010",8.7,2194,"After a 200-year-old medicine jar found on an off-shore shipwreck shatters in a teenage girl's palm, she is admitted to Princeton Plainsboro for symptoms closely linked to smallpox. When the Center for Disease Control's Dr. Dave Broda institutes a lockdown on the hospital and suspends House's team's ability to diagnose, Masters is skeptical about Broda's diagnosis and becomes convinced that the patient is suffering from a different disease. The girl's father soon experiences similar symptoms, and House is forced to make a precarious decision that puts his own life in ..."
"202",7,8,140,"Small Sacrifices","Ramon Silva","Sequelae of malnutrition and other nutritional deficiencies","E64","NUTRITION","GI","Greg Yaitanes","David Hoselton",9240000,"22 Nov. 2010",7.7,1827,"Science and faith are called into question when a patient is admitted to the hospital following his reenactment of the Crucifixion. The patient, Ramon Silva, refuses to undergo the prescribed treatment, and the team learns that after his daughter's cancer was cured, he pledged an oath of self-sacrifice to God. With little time to save Ramon's life, the team struggles to understand his reasoning and seemingly extreme religious convictions, but eventually learn that faith is not an argument. Meanwhile, Taub questions his wife Rachel about her relationship with an ..."
"203",7,8,140,"Small Sacrifices","Ramon Silva","Multiple sclerosis","G35","AUTOIMMUNE","NS","Greg Yaitanes","David Hoselton",9240000,"22 Nov. 2010",7.7,1827,"Science and faith are called into question when a patient is admitted to the hospital following his reenactment of the Crucifixion. The patient, Ramon Silva, refuses to undergo the prescribed treatment, and the team learns that after his daughter's cancer was cured, he pledged an oath of self-sacrifice to God. With little time to save Ramon's life, the team struggles to understand his reasoning and seemingly extreme religious convictions, but eventually learn that faith is not an argument. Meanwhile, Taub questions his wife Rachel about her relationship with an ..."
"204",7,8,140,"Small Sacrifices","Ramon Silva","Multiple sclerosis","G35","NEUROLOGIC","NS","Greg Yaitanes","David Hoselton",9240000,"22 Nov. 2010",7.7,1827,"Science and faith are called into question when a patient is admitted to the hospital following his reenactment of the Crucifixion. The patient, Ramon Silva, refuses to undergo the prescribed treatment, and the team learns that after his daughter's cancer was cured, he pledged an oath of self-sacrifice to God. With little time to save Ramon's life, the team struggles to understand his reasoning and seemingly extreme religious convictions, but eventually learn that faith is not an argument. Meanwhile, Taub questions his wife Rachel about her relationship with an ..."
"205",7,9,141,"Larger Than Life","Jack","Varicella with other complications","B018","INFECTIOUS","SKIN","Miguel Sapochnik","Sara Hess",10520000,"17 Jan. 2011",8.4,1926,"When a woman falls on the subway tracks, Jack jumps down, saves her and faints. Martha finds him in ER. When the hospital uses Taub's photo for promotion, his wife's aroused. House meets Cuddy's mom."
"206",7,10,142,"Carrot or Stick","Driscoll and Landon Parks","Other porphyria","E802","METABOLIC","SKIN","David Straiton","Liz Friedman",10450000,"24 Jan. 2011",8,1801,"A disciplinary training camp drill instructor collapses with back pain. One of the 24 boys joins him in hospital. Someone has access to Chase's social media account and credit card. Cuddy wants Rachel in a good preschool."
"207",7,11,143,"Family Practice","Arlene Cuddy","Toxic effect: Other metals","T568","METABOLIC","liver","Miguel Sapochnik","Peter Blake",12330000,"7 Feb. 2011",8.6,2034,"Cuddy's mom has heart problems and is admitted. Secrets come out about her mom."
"208",7,12,144,"You Must Remember This","Nadia","MacLeod syndrome","J430","RESP","NS, BV","David Platt","Kath Lingenfelter",9860000,"14 Feb. 2011",7.9,1784,"When a waitress with a perfect memory suffers temporary paralysis, her older sister visits her in the hospital, which triggers high stress levels and even more health complications. The patient's sharp memory proves detrimental when a grudge she's been holding against her sibling gets in the way of receiving proper medical treatment, and Masters discovers that patching a broken sisterhood may prove to be more complex than diagnosing the patient. Meanwhile, Foreman volunteers to help Taub prepare for a medical examination, and House, determined to help Wilson get back ..."
"209",7,12,144,"You Must Remember This","Nadia","Obsessive-compulsive disorder","F42","PSYCHIATRIC","NS","David Platt","Kath Lingenfelter",9860000,"14 Feb. 2011",7.9,1784,"When a waitress with a perfect memory suffers temporary paralysis, her older sister visits her in the hospital, which triggers high stress levels and even more health complications. The patient's sharp memory proves detrimental when a grudge she's been holding against her sibling gets in the way of receiving proper medical treatment, and Masters discovers that patching a broken sisterhood may prove to be more complex than diagnosing the patient. Meanwhile, Foreman volunteers to help Taub prepare for a medical examination, and House, determined to help Wilson get back ..."
"210",7,13,145,"Two Stories","Phillip Wright","Foreign body in bronchus","T175","RESP","BRONCHUS","Greg Yaitanes","Thomas L. Moran",10410000,"21 Feb. 2011",8.9,2766,"House entertains a school class on Career Day telling about his patient, a college student, who coughed up his lung. He spices up the story with quotes from movies. He later gets advice from 2 students outside principal's office."
"211",7,14,146,"Recession Proof","Bert Eskey","Non-neuropathic heredofamilial amyloidosis","E850","METABOLIC","NS","S. J. Clarkson","John C. Kelley",11010000,"28 Feb. 2011",7.9,1807,"A man cleans crime scenes after losing his real estate company. His wife doesn't know. He suddenly gets a fit at a restaurant. Masters thinks, he lied about his job. Foreman throws Taub out. Cuddy gets an award."
"212",7,15,147,"Bombshells","Ryan","Staphylococcal infection, unspecified site","A490","INFECTIOUS","NOSE","Greg Yaitanes","Liz Friedman & Sara Hess",11080000,"7 Mar. 2011",8.6,2512,"Tension reaches new heights when Cuddy faces sobering news that propels her to reevaluate her priorities. While House is distracted by his concern for Cuddy's well-being, the team treats a teenage patient whose worsening symptoms and suspicious body scars indicate more than just physical illness. Sensing the teen's troubled emotional and mental state, Taub turns to the patient's personal life for clues and uncovers disturbing home videos that could put the lives of his peers in danger. Meanwhile, Cuddy remains hopeful that House will be fully present when she needs ..."
"213",7,15,147,"Bombshells","Ryan","Benign neoplasm: Kidney","D300","NEOPLASTIC","REN","Greg Yaitanes","Liz Friedman & Sara Hess",11080000,"7 Mar. 2011",8.6,2512,"Tension reaches new heights when Cuddy faces sobering news that propels her to reevaluate her priorities. While House is distracted by his concern for Cuddy's well-being, the team treats a teenage patient whose worsening symptoms and suspicious body scars indicate more than just physical illness. Sensing the teen's troubled emotional and mental state, Taub turns to the patient's personal life for clues and uncovers disturbing home videos that could put the lives of his peers in danger. Meanwhile, Cuddy remains hopeful that House will be fully present when she needs ..."
"214",7,15,147,"Bombshells","Cuddy","Personal history of allergy to other antibiotic agents","Z881","ALLERGIC","LYMPH NODE","Greg Yaitanes","Liz Friedman & Sara Hess",11080000,"7 Mar. 2011",8.6,2512,"Tension reaches new heights when Cuddy faces sobering news that propels her to reevaluate her priorities. While House is distracted by his concern for Cuddy's well-being, the team treats a teenage patient whose worsening symptoms and suspicious body scars indicate more than just physical illness. Sensing the teen's troubled emotional and mental state, Taub turns to the patient's personal life for clues and uncovers disturbing home videos that could put the lives of his peers in danger. Meanwhile, Cuddy remains hopeful that House will be fully present when she needs ..."
"215",7,15,147,"Bombshells","Cuddy","Personal history of allergy to other antibiotic agents","Z881","ALLERGIC","liver","Greg Yaitanes","Liz Friedman & Sara Hess",11080000,"7 Mar. 2011",8.6,2512,"Tension reaches new heights when Cuddy faces sobering news that propels her to reevaluate her priorities. While House is distracted by his concern for Cuddy's well-being, the team treats a teenage patient whose worsening symptoms and suspicious body scars indicate more than just physical illness. Sensing the teen's troubled emotional and mental state, Taub turns to the patient's personal life for clues and uncovers disturbing home videos that could put the lives of his peers in danger. Meanwhile, Cuddy remains hopeful that House will be fully present when she needs ..."
"216",7,16,148,"Out of the Chute","Lane","Bartonellosis","A44","INFECTIOUS","LYMPH NODE","Sanford Bookstaver","Lawrence Kaplow & Thomas L. Moran",10410000,"14 Mar. 2011",8.9,2538,"Cuddy dumped House. He moves into a luxury hotel and goes on a Vicodin, booze and cute hooker binge. The team gets a trampled rodeo bull rider but needs House to save him. Masters has a crush on their patient."
"217",7,17,149,"Fall from Grace","Danny Jennings","Refsum disease","G601","NEUROLOGIC","NS","Tucker Gates","John C. Kelley",9490000,"21 Mar. 2011",8.4,2049,"A young homeless man who is a former drug addict is found in a park showing signs of olfactory impairment and horrific scars and burn marks on his chest. With an uncertain identity and the patient's severely worsening conditions, the team looks to the patient's personal records and family history in order to understand his detachment. Meanwhile, Cuddy confides in Wilson and expresses her guilt for ending her relationship with House, and just as the team warms up to the patient, they discover a disturbing secret about the man whose life they saved."
"218",7,18,150,"The Dig","Nina","Q fever","A78","INFECTIOUS","heart""","Matt Shakman","David Hoselton & Sara Hess",8930000,"11 Apr. 2011",8.9,2368,"The team treats a patient with a secret home life. Thirteen is released from prison. House enlists Thirteen to participate in a spud gun competition."
"219",7,18,150,"The Dig","Brian","Q fever","A78","INFECTIOUS","heart""","Matt Shakman","David Hoselton & Sara Hess",8930000,"11 Apr. 2011",8.9,2368,"The team treats a patient with a secret home life. Thirteen is released from prison. House enlists Thirteen to participate in a spud gun competition."
"220",7,18,150,"The Dig","Brian","Ehlers-Danlos syndrome","Q796","OBSGYN","BV","Matt Shakman","David Hoselton & Sara Hess",8930000,"11 Apr. 2011",8.9,2368,"The team treats a patient with a secret home life. Thirteen is released from prison. House enlists Thirteen to participate in a spud gun competition."
"221",7,18,150,"The Dig","Nina","Ehlers-Danlos syndrome","Q796","OBSGYN","BV","Matt Shakman","David Hoselton & Sara Hess",8930000,"11 Apr. 2011",8.9,2368,"The team treats a patient with a secret home life. Thirteen is released from prison. House enlists Thirteen to participate in a spud gun competition."
"222",7,19,151,"Last Temptation","Kendall Pearson","Lymphosarcoma","C850","NEOPLASTIC","LYMPH","Tim Southam","David Foster & Liz Friedman",8800000,"18 Apr. 2011",8.5,1912,"Masters faces a career crossroads on her last day as a medical student and struggles with the choice to continue on the path to become a surgeon or to accept the rare opportunity to join House's team officially. Meanwhile, the team treats a 16-year-old girl who inexplicably collapsed days before embarking on an ambitious sailing tour around the globe. Despite the patient's life-changing diagnosis, the patient's family insists on getting her back on the seas in time for her potentially record-breaking launch. But to the team's surprise, including House, Masters makes a..."
"223",7,20,152,"Changes","Cyrus Harry","Benign neoplasm: Transverse colon","D123","NEOPLASTIC","GI","David Straiton","Story by: Eli Attie & Seth HoffmanTeleplay by: Eli Attie",8570000,"2 May 2011",7.9,1701,"Arlene Cuddy returns and House and Cuddy's jobs are in danger when Arlene tries to sue the hospital."
"224",7,21,153,"The Fix","Dr. Wendy Lee","Poisoning: Other topical agents","T498","METABOLIC","liver","Greg Yaitanes","Story by: Thomas L. MoranTeleplay by: Thomas L. Moran & David Shore",7940000,"9 May 2011",7.8,1703,"When House and Wilson bet on a boxing match and disagree over the outcome, Wilson gives him exactly one day to pay up or prove him wrong."
"225",7,21,153,"The Fix","Terry Foley","Haemangioma and lymphangioma, any site","D18","NEOPLASTIC","BV, LYMPH NODE","Greg Yaitanes","Story by: Thomas L. MoranTeleplay by: Thomas L. Moran & David Shore",7940000,"9 May 2011",7.8,1703,"When House and Wilson bet on a boxing match and disagree over the outcome, Wilson gives him exactly one day to pay up or prove him wrong."
"226",7,22,154,"After Hours","Darrien","Amoebiasis","A06","INFECTIOUS","GI","Miguel Sapochnik","Seth Hoffman & Russel Friend & Garrett Lerner",8920000,"16 May 2011",9.2,2785,"Darrien steals a car after getting stabbed and hurries to her friend 13's home for help. Chase brings an ultrasound and helps. House performs surgery on his own leg at home after using experimental drugs."
"227",7,23,155,"Moving On","Afsoun Hamidi","Wegener granulomatosis","M313","AUTOIMMUNE","BV","Greg Yaitanes","Kath Lingenfelter & Peter Blake",9110000,"23 May 2011",8.5,2502,"A known performance artist collapses during a performance. She ends with House's team, which is what she wanted. House is more self-destructive and irresponsible than usual. Cuddy's sister finds a date for her."
"228",7,23,155,"Moving On","Afsoun Hamidi","Wegener granulomatosis","M313","CONNECTIVE","BV","Greg Yaitanes","Kath Lingenfelter & Peter Blake",9110000,"23 May 2011",8.5,2502,"A known performance artist collapses during a performance. She ends with House's team, which is what she wanted. House is more self-destructive and irresponsible than usual. Cuddy's sister finds a date for her."
"229",8,1,156,"Twenty Vicodin","Nick","Mastocytosis","Q822","OBSGYN","SKIN","Greg Yaitanes","Peter Blake",9780000,"3 Oct. 2011",8.8,2865,"House gets parole at his hearing, but he still has to survive 5 more days in a prison filled with violent criminals. One of them wants 20 Vicodin ""or else"". He helps the prison doctor diagnose a patient."
"230",8,2,157,"Transplant","Two lungs in a box","Pulmonary eosinophilia, not elsewhere classified","J82","RESP","LUNGS","Dan Attias","Liz Friedman & David Foster",6850000,"10 Oct. 2011",8.2,2034,"A surprising visitor makes House an offer he can't refuse by giving him the opportunity to help the Princeton Plainsboro team treat a unique patient in order to save the life of an organ recipient being administered by Wilson. Although House finds himself back on familiar ground, he quickly realizes that much has changed since he left, and he is forced to work on the case with smart yet timid resident Dr. Chi Park. After several inconclusive treatments and with time running out, House and Dr. Park are left with one last option to examine the patient's medical history ..."
"231",8,3,158,"Charity Case","Benjamin Byrd","Thyrotoxicosis with toxic multinodular goitre","E052","METABOLIC","THYROID GLAND","Greg Yaitanes","Sara Hess",8340000,"17 Oct. 2011",8.2,1968,"When Benjamin suddenly collapses after making a rare and generous donation, House and Dr. Chi Park are convinced that his extreme altruistic behavior may indicate a deeper medical disorder. With no definitive explanation for Benjamin's loss of consciousness and unresponsiveness to treatment, House pushes just the right buttons to recruit former prison doctor Jessica Adams to volunteer her time and expertise to the case. Benjamin then makes a bold but life-threatening offer that could save another life, and the team must diagnose his disorder before he puts his own ..."
"232",8,4,159,"Risky Business","Thad Barton","Seropositive rheumatoid arthritis","M05","AUTOIMMUNE","BONES","Sanford Bookstaver","Seth Hoffman",6650000,"31 Oct. 2011",7.9,1814,"A businessman, about to move 1000s of jobs to China, needs to see a doctor. House needs a donation. Park bets with House on not getting fired. House tries to raise funds for insider trading in his patient's company."
"233",8,4,159,"Risky Business","Thad Barton","Seropositive rheumatoid arthritis","M05","CONNECTIVE","BONES","Sanford Bookstaver","Seth Hoffman",6650000,"31 Oct. 2011",7.9,1814,"A businessman, about to move 1000s of jobs to China, needs to see a doctor. House needs a donation. Park bets with House on not getting fired. House tries to raise funds for insider trading in his patient's company."
"234",8,4,159,"Risky Business","Thad Barton","Other specified hereditary haemolytic anaemias","D588","VASCULAR","BLOOD","Sanford Bookstaver","Seth Hoffman",6650000,"31 Oct. 2011",7.9,1814,"A businessman, about to move 1000s of jobs to China, needs to see a doctor. House needs a donation. Park bets with House on not getting fired. House tries to raise funds for insider trading in his patient's company."
"235",8,5,160,"The Confession","Bob Harris","Mucocutaneous lymph node syndrome [Kawasaki]","M303","CONNECTIVE","LYMPH NODE","Kate Woods","John C. Kelley",7550000,"7 Nov. 2011",8.4,1889,"There's money now to hire Chase, Taub and Adams. A ""model citizen"" gets a seizure while cheating on his wife in a motel. He's House's new team's first patient. Is Taub dad to any of ""his"" two babies?"
"236",8,6,161,"Parents","Ben Parker","Syphilis, unspecified","A539","INFECTIOUS","UG, NS","Greg Yaitanes","Eli Attie",6630000,"14 Nov. 2011",8,1705,"A teenage boy attempting to follow in his late father's footsteps as an entertainer is admitted to Princeton Plainsboro with partial paralysis. As the team searches for a bone marrow match, they uncover a disturbing family secret. Meanwhile, House looks for creative ways to remove his ankle monitor so that he can attend a boxing match in Atlantic City, and he treats a patient who is convinced he is suffering from diabetes. Also, Taub faces a tough decision when his ex-wife Rachel tells him that she wants to move across the country with their infant daughter."
"237",8,6,161,"Parents","Ben Parker","Poisoning by systemic antibiotics","T36","METABOLIC","liver","Greg Yaitanes","Eli Attie",6630000,"14 Nov. 2011",8,1705,"A teenage boy attempting to follow in his late father's footsteps as an entertainer is admitted to Princeton Plainsboro with partial paralysis. As the team searches for a bone marrow match, they uncover a disturbing family secret. Meanwhile, House looks for creative ways to remove his ankle monitor so that he can attend a boxing match in Atlantic City, and he treats a patient who is convinced he is suffering from diabetes. Also, Taub faces a tough decision when his ex-wife Rachel tells him that she wants to move across the country with their infant daughter."
"238",8,7,162,"Dead & Buried","Iris and Drew Lemayne","Dissociative [conversion] disorders","F44","PSYCHIATRIC","BRAIN, NS ","Miguel Sapochnik","David Hoselton",7460000,"21 Nov. 2011",8.2,1794,"House is more interested in a case that Foreman brings of a 4 year old dead boy than the 14 year old live girl. The team takes care of her while he sees the boy's dad and corpse."
"239",8,7,162,"Dead & Buried","Iris Lemayne","Malignant neoplasm of placenta","C58","NEOPLASTIC","PLACENTA","Miguel Sapochnik","David Hoselton",7460000,"21 Nov. 2011",8.2,1794,"House is more interested in a case that Foreman brings of a 4 year old dead boy than the 14 year old live girl. The team takes care of her while he sees the boy's dad and corpse."
"240",8,7,162,"Dead & Buried","Drew Lemayne","Other specified congenital malformation syndromes, not elsewhere classified","Q878","OBSGYN","UG","Miguel Sapochnik","David Hoselton",7460000,"21 Nov. 2011",8.2,1794,"House is more interested in a case that Foreman brings of a 4 year old dead boy than the 14 year old live girl. The team takes care of her while he sees the boy's dad and corpse."
"241",8,8,163,"Perils of Paranoia","Tommy","Diphtheria","A36","INFECTIOUS","PHARYNX","David Straiton","Thomas L. Moran",7410000,"28 Nov. 2011",7.9,1747,"A prosecutor in court thinks, he has a heart attack. Is it an anxiety attack? He has an arsenal hidden from his wife in their home. Taub tries to fix Foreman up with a nurse."
"242",8,9,164,"Better Half","Andres Tavares","Reye syndrome","G937","PEDIATRIC","LIVER, NS","Greg Yaitanes","Kath Lingenfelter",8760000,"23 Jan. 2012",8.1,1785,"A man with Alzheimer's is offered a trial treatment after which he pukes blood. He ends with House and co. His wife claims to have an asexual marriage. House doesn't believe in asexual and bets Wilson."
"243",8,9,164,"Better Half","Andres Tavares","Reye syndrome","G937","NEUROLOGIC","LIVER, NS","Greg Yaitanes","Kath Lingenfelter",8760000,"23 Jan. 2012",8.1,1785,"A man with Alzheimer's is offered a trial treatment after which he pukes blood. He ends with House and co. His wife claims to have an asexual marriage. House doesn't believe in asexual and bets Wilson."
"244",8,10,165,"Runaways","Callie Rogers","Ascariasis","B77","INFECTIOUS","GI","Sanford Bookstaver","Marqui Jackson",8730000,"30 Jan. 2012",7.8,1721,"A runaway girl thinks she has asthma. While seeing House, her ear starts bleeding. Further treatment requires adult consent or social services. House enjoys not having an ankle monitor."
"245",8,11,166,"Nobody's Fault","Bill Koppelman","Tumour lysis syndrome","E883","NEOPLASTIC","SKIN, THYROID GLAND, GI","Greg Yaitanes","David Foster & Russel Friend & Garrett Lerner",7090000,"6 Feb. 2012",9.2,2852,"When a violent incident involving a patient has serious consequences for one staff member, House and the team are placed under review by Dr. Walter Cofield, Foreman's former mentor and current Chief of Neurology. As House and each member of his team recount the details of the dramatic and life-threatening incident, Cofield must weigh the team's unconventional brand of collaboration against their ability to save lives."
"246",8,12,167,"Chase","Moira Parker","Other giant cell arteritis","M316","AUTOIMMUNE","VASCULAR","Matt Shakman","Peter Blake & Eli Attie",7160000,"13 Feb. 2012",8.9,2406,"Chase is back. His first patient is a cute nun about to make her final vow. While still blaming House, he needs his help with his patient. House and Taub try to one-up each other with pranks."
"247",8,12,167,"Chase","Moira Parker","Other giant cell arteritis","M316","CONNECTIVE","VASCULAR","Matt Shakman","Peter Blake & Eli Attie",7160000,"13 Feb. 2012",8.9,2406,"Chase is back. His first patient is a cute nun about to make her final vow. While still blaming House, he needs his help with his patient. House and Taub try to one-up each other with pranks."
"248",8,13,168,"Man of the House","Joe Reese","Autoimmune thyroiditis","E063","AUTOIMMUNE","THYROID GLAND","Colin Bucksey","Sara Hess & Liz Friedman",7080000,"20 Feb. 2012",8,1705,"A marriage counselor collapses during a speaking engagement, but when he is put under close evaluation, the team notice changes in his behavior that conflict with his motivational message on the roles of men and women. Meanwhile, House and his Ukrainian ""wife"" Dominika make a deal to convince Immigration that they are a happily married couple. Also, House decides to name a team leader."
"249",8,14,169,"Love Is Blind","Will Westwood","Mucormycosis, unspecified","B465","INFECTIOUS","LUNGS","Tim Southam","John C. Kelley",5940000,"19 Mar. 2012",8,1782,"A blind man has just bought an engagement ring when his hearing gets super sensitive. Seizure? House's mom drops by with a surprise. Park has an LSD trip."
"250",8,15,170,"Blowing the Whistle","Brant Macklin","Typhus fever","A75","INFECTIOUS","REN, LUNGS, SKIN","Julian Higgins","Story by: Danny WeissTeleplay by: Danny Weiss & Seth Hoffman",6670000,"2 Apr. 2012",7.4,1697,"A patient is caught between family and a code of honor."
