"","season","episode_num_in_season","episode_num_overall","Episode","patients_name","medical_diagnosis","icd_code","category","organs_affected","directed_by","written_by","us_viewers","original_air_date","imdb_rating","total_votes","description"
"1",1,1,1,"Pilot","Rebecca Adler","Cysticercosis of central nervous system","B690","INFECTIOUS","NS","Bryan Singer","David Shore",7050000,"16 Nov. 2004",8.6,4987,"Young kindergarten teacher Rebecca Adler collapses in her classroom after losing intelligible speech while teaching students."
"2",1,2,2,"Paternity","Dan","Subacute sclerosing panencephalitis","A811","INFECTIOUS","NS","Peter O'Fallon","Lawrence Kaplow",6090000,"23 Nov. 2004",8.2,3595,"The team helps a high school boy (16) who has double vision and night terrors. (Clinic Cases: Unvaccinated baby, man with boil on leg.)"
"3",1,3,3,"Occam's Razor","Brandon Merrell","Poisoning: Drugs affecting uric acid metabolism","T504","METABOLIC","REN","Bryan Singer","David Shore",6330000,"30 Nov. 2004",8.2,3381,"A college boy whose low blood pressure does not respond with IV fluids piques House's curiosity. Clinic Cases: A woman who had a cold last week, man with a sore throat, woman whose leg hurts after running 6 miles, a boy and his MP3 Player."
"4",1,4,4,"Maternity","Baby Girl Hartig","Acute bronchitis due to echovirus","J207","PEDIATRIC","LUNGS","Newton Thomas Sigel","Peter Blake",6740000,"7 Dec. 2004",8.4,3276,"A nightmare scenario hits Princeton Plainsboro when babies in the maternity ward are hit by a potentially fatal epidemic. Clinic Cases: Woman with a parasite!"
"5",1,4,4,"Maternity","Baby Girl Hartig","Acute bronchitis due to echovirus","J207","RESP","LUNGS","Newton Thomas Sigel","Peter Blake",6740000,"7 Dec. 2004",8.4,3276,"A nightmare scenario hits Princeton Plainsboro when babies in the maternity ward are hit by a potentially fatal epidemic. Clinic Cases: Woman with a parasite!"
"6",1,4,4,"Maternity","Baby Boy Howson","Acute bronchitis due to echovirus","J207","PEDIATRIC","LUNGS","Newton Thomas Sigel","Peter Blake",6740000,"7 Dec. 2004",8.4,3276,"A nightmare scenario hits Princeton Plainsboro when babies in the maternity ward are hit by a potentially fatal epidemic. Clinic Cases: Woman with a parasite!"
"7",1,4,4,"Maternity","Baby Boy Howson","Acute bronchitis due to echovirus","J207","RESP","LUNGS","Newton Thomas Sigel","Peter Blake",6740000,"7 Dec. 2004",8.4,3276,"A nightmare scenario hits Princeton Plainsboro when babies in the maternity ward are hit by a potentially fatal epidemic. Clinic Cases: Woman with a parasite!"
"8",1,4,4,"Maternity","Baby Boy Chen-Lupino","Acute bronchitis due to echovirus","J207","PEDIATRIC","LUNGS","Newton Thomas Sigel","Peter Blake",6740000,"7 Dec. 2004",8.4,3276,"A nightmare scenario hits Princeton Plainsboro when babies in the maternity ward are hit by a potentially fatal epidemic. Clinic Cases: Woman with a parasite!"
"9",1,4,4,"Maternity","Baby Boy Chen-Lupino","Acute bronchitis due to echovirus","J207","RESP","LUNGS","Newton Thomas Sigel","Peter Blake",6740000,"7 Dec. 2004",8.4,3276,"A nightmare scenario hits Princeton Plainsboro when babies in the maternity ward are hit by a potentially fatal epidemic. Clinic Cases: Woman with a parasite!"
"10",1,4,4,"Maternity","?","Acute bronchitis due to echovirus","J207","PEDIATRIC","LUNGS","Newton Thomas Sigel","Peter Blake",6740000,"7 Dec. 2004",8.4,3276,"A nightmare scenario hits Princeton Plainsboro when babies in the maternity ward are hit by a potentially fatal epidemic. Clinic Cases: Woman with a parasite!"
"11",1,4,4,"Maternity","?","Acute bronchitis due to echovirus","J207","RESP","LUNGS","Newton Thomas Sigel","Peter Blake",6740000,"7 Dec. 2004",8.4,3276,"A nightmare scenario hits Princeton Plainsboro when babies in the maternity ward are hit by a potentially fatal epidemic. Clinic Cases: Woman with a parasite!"
"12",1,5,5,"Damned If You Do","Sister Mary Augustine","Toxic effect: Copper and its compounds","T564","METABOLIC","liver","Greg Yaitanes","Sara B. Cooper",6910000,"14 Dec. 2004",8.2,3158,"A nun suffering from acute dermatitis and asthma treated by House with possibly the wrong medication comes dangerously close to death."
"13",1,6,6,"The Socratic Method","Lucy Palmeiro","Deficiency of vitamin K","E561","NUTRITION","BV, BONES","Peter Medak","John Mankiewicz",6730000,"21 Dec. 2004",8.5,3113,"A 38-year-old mother, apparently suffering from thrombosis, alcoholism and schizophrenia, has only her underage 15-year-old son as caregiver."
"14",1,6,6,"The Socratic Method","Lucy Palmeiro","Deficiency of vitamin K","E561","NUTRITION","BV","Peter Medak","John Mankiewicz",6730000,"21 Dec. 2004",8.5,3113,"A 38-year-old mother, apparently suffering from thrombosis, alcoholism and schizophrenia, has only her underage 15-year-old son as caregiver."
"15",1,6,6,"The Socratic Method","Lucy Palmeiro","Malignant neoplasm: Liver cell carcinoma","C220","NEOPLASTIC","liver","Peter Medak","John Mankiewicz",6730000,"21 Dec. 2004",8.5,3113,"A 38-year-old mother, apparently suffering from thrombosis, alcoholism and schizophrenia, has only her underage 15-year-old son as caregiver."
"16",1,6,6,"The Socratic Method","Lucy Palmeiro","Disorders of copper metabolism","E830","METABOLIC","liver","Peter Medak","John Mankiewicz",6730000,"21 Dec. 2004",8.5,3113,"A 38-year-old mother, apparently suffering from thrombosis, alcoholism and schizophrenia, has only her underage 15-year-old son as caregiver."
"17",1,7,7,"Fidelity","Elise Snow","African trypanosomiasis","B56","INFECTIOUS","BV, NS","Bryan Spicer","Thomas L. Moran",6910000,"28 Dec. 2004",8.2,3039,"A woman comes down with symptoms of African sleeping sickness, but there seems to be no way she could have contracted it. House and his aides must ask a few tough questions and make some tough decisions in order to try to save her."
"18",1,8,8,"Poison","Matt Davis","Toxic effect: Organophosphate and carbamate insecticides","T600","METABOLIC","SKIN","Guy Ferland","Matt Witten",12370000,"25 Jan. 2005",8.1,2898,"A high school boy has hallucinations and collapses during an exam. When he does not respond to treatments, and the normal tests are negative, Foreman presents the case to House. Clinic Cases: A happy old lady."
"19",1,8,8,"Poison","Chi Ling","Toxic effect: Organophosphate and carbamate insecticides","T600","METABOLIC","SKIN","Guy Ferland","Matt Witten",12370000,"25 Jan. 2005",8.1,2898,"A high school boy has hallucinations and collapses during an exam. When he does not respond to treatments, and the normal tests are negative, Foreman presents the case to House. Clinic Cases: A happy old lady."
"20",1,9,9,"DNR","John Henry Giles","Arteriovenous fistula, acquired","I770","VASCULAR","BV","Frederick King Keller","David Foster",12750000,"1 Feb. 2005",8.8,3323,"A famous jazz trumpeter, diagnosed with ALS, signs a DNR form, but because House believes the diagnosis wrong, he breaks the law by resuscitating him."
"21",1,10,10,"Histories","Victoria Madsen","Rabies","A82","INFECTIOUS","NS","Dan Attias","Joel Thompson",14970000,"8 Feb. 2005",8.5,2999,"A delusional homeless woman is found unconscious in an acid house exhibiting a variety of symptoms which Foreman thinks she's faking."
"22",1,11,11,"Detox","Keith Foster","Toxic effect: Other insecticides","T602","METABOLIC","liver","Nelson McCormick","Lawrence Kaplow & Thomas L. Moran",14220000,"15 Feb. 2005",8.7,3106,"A girl crashes a Porsche after her boyfriend starts coughing up blood and continues to have unexplained bleeds. Clinic Cases: Cuddy gives House a month off clinic duties if he can spend a week off his pain meds."
"23",1,12,12,"Sports Medicine","Hank Wiggen","Toxic effect: Cadmium and its compounds","T563","METABOLIC","UG, LIVER","Keith Gordon","John Mankiewicz & David Shore",15530000,"22 Feb. 2005",8,2709,"A detoxed sports star about to make his comeback breaks his arm due to brittle bones. Clinic Cases: Woman with leg pain, man trying to remove his contact lenses, a dentist with various issues, and a hung over teenager - all in 70 seconds."
"24",1,13,13,"Cursed","Gabriel Reilich","Leprosy [Hansen disease]","A30","INFECTIOUS","SKIN","Daniel Sackheim","Matt Witten & Peter Blake",15530000,"1 Mar. 2005",8.2,2745,"A young boy's fever lasts nearly a week after a Ouija board predicts he will die. Clinic Cases: Chase's case of a man with numb fingers."
"25",1,14,14,"Control","Carly Forlano","Congestive heart failure","I500","HEART","heart""","Randy Zisk","Lawrence Kaplow",17330000,"15 Mar. 2005",8.7,2937,"Can House save a high powered female executive from the same problem that has left him in constant pain? A new head of the hospital board could cause problems. Clinic cases: A boy and his mute dad."
"26",1,14,14,"Control","Carly Forlano","Congestive heart failure","I500","VASCULAR","heart""","Randy Zisk","Lawrence Kaplow",17330000,"15 Mar. 2005",8.7,2937,"Can House save a high powered female executive from the same problem that has left him in constant pain? A new head of the hospital board could cause problems. Clinic cases: A boy and his mute dad."
"27",1,15,15,"Mob Rules","Joey Arnello","Disorders of ornithine metabolism","E724","METABOLIC","liver","Tim Hunter","David Foster & John Mankiewicz",17340000,"22 Mar. 2005",8,2651,"A Mob informer collapses before trial. Is he faking or is he really in a coma? Clinic Cases: A pair of brothers come in when the youngster gets toys stuck up his nose."
"28",1,16,16,"Heavy","Jessica Simms","Pituitary-dependent Cushing disease","E240","NEOPLASTIC","NS","Fred Gerber","Thomas L. Moran",18280000,"29 Mar. 2005",8.4,2645,"A morbidly obese ten-year-old girl has a heart attack, and her mother insists that House and his team look past her weight to find the diagnosis. Meanwhile, Vogler pressures House to fire a member of his staff. Clinic Patients: Unidentified man with an infected pierced scrotum; overweight woman with a 30-pound tumor on her ovaries who refuses to have it removed, because she worries she will be unattractive."
"29",1,17,17,"Role Model","Gary H. Wright","Immunodeficiency following hereditary defective response to Epstein-Barr virus","D823","AUTOIMMUNE","LYMPH NODE","Peter O'Fallon","Matt Witten",15040000,"12 Apr. 2005",8.6,2754,"An ambitious and charismatic Black senator campaigning for the presidency falls ill from a mysterious malady, possibly AIDS."
"30",1,18,18,"Babies & Bathwater","Naomi Randolph","Benign neoplasm: Bronchus and lung","D143","NEOPLASTIC","LUNGS","Bill Johnson","Story by: Peter BlakeTeleplay by: Peter Blake & David Shore",17480000,"19 Apr. 2005",8.9,3025,"While House and his team scramble to discover what's causing brain and kidney dysfunction in a pregnant woman, Vogler is on the warpath to get House fired."
"31",1,19,19,"Kids","Mary Carroll","Secondary thrombocytopenia","D695","AUTOIMMUNE","BV","Deran Sarafian","Thomas L. Moran & Lawrence Kaplow",17140000,"3 May 2005",8.3,2693,"During a meningitis outbreak which overwhelms the clinic, House is drawn to a single patient: a 12-year-old competitive diver whose symptoms don't quite match everyone else's."
"32",1,20,20,"Love Hurts","Harvey Park","Osteomyelitis","M86","CONNECTIVE","BONES","Bryan Spicer","Sara B. Cooper",18800000,"10 May 2005",8.3,2743,"House has to deal with his promised dinner date with Cameron, a mysterious stroke in a clinic patient and a libidinous senior citizen."
"33",1,21,21,"Three Stories","The Farmer","Necrotizing fasciitis","M726","CONNECTIVE","MUSCLE","Paris Barclay","David Shore",17680000,"17 May 2005",9.6,7221,"House's ex Stacy Warner asks him to treat her husband. House takes over a diagnostics class for a day and presents the class with three case studies of leg pain. As House tells his story and the class gradually fills up with listeners, the class learns a lot about how to be better doctors, and Chase, Foreman and Cameron learn some important details of House's past."
"34",1,21,21,"Three Stories","Volleyball Player","Malignant neoplasm, without specification of site","C80","NEOPLASTIC","BONES","Paris Barclay","David Shore",17680000,"17 May 2005",9.6,7221,"House's ex Stacy Warner asks him to treat her husband. House takes over a diagnostics class for a day and presents the class with three case studies of leg pain. As House tells his story and the class gradually fills up with listeners, the class learns a lot about how to be better doctors, and Chase, Foreman and Cameron learn some important details of House's past."
"35",1,21,21,"Three Stories","Volleyball Player","Malignant neoplasm, without specification of site","C80","NEOPLASTIC","BONE","Paris Barclay","David Shore",17680000,"17 May 2005",9.6,7221,"House's ex Stacy Warner asks him to treat her husband. House takes over a diagnostics class for a day and presents the class with three case studies of leg pain. As House tells his story and the class gradually fills up with listeners, the class learns a lot about how to be better doctors, and Chase, Foreman and Cameron learn some important details of House's past."
"36",1,21,21,"Three Stories","Carmen Electra/Middle aged man/Gregory House","Ischaemic infarction of muscle","M622","CONNECTIVE","MUSCLE","Paris Barclay","David Shore",17680000,"17 May 2005",9.6,7221,"House's ex Stacy Warner asks him to treat her husband. House takes over a diagnostics class for a day and presents the class with three case studies of leg pain. As House tells his story and the class gradually fills up with listeners, the class learns a lot about how to be better doctors, and Chase, Foreman and Cameron learn some important details of House's past."
"37",1,22,22,"Honeymoon","Mark Warner","Other porphyria","E802","METABOLIC","SKIN","Frederick King Keller","Lawrence Kaplow & John Mankiewicz",19520000,"24 May 2005",8.7,2876,"House doses his ex-girlfriend's husband in order to get him into hospital after she begs House to treat him. Is House treating Mark differently in order to get back at Stacy for his leg?"
"38",2,1,23,"Acceptance","Clarence","Malignant neoplasm: Medulla of adrenal gland","C741","NEOPLASTIC","UG","Dan Attias","Russel Friend & Garrett Lerner",15910000,"13 Sep. 2005",8.4,2778,"House treats a patient on death row while Dr. Cameron avoids telling a patient she has a terminal illness."
"39",2,2,24,"Autopsy","Andie","Cerebral infarction due to thrombosis of cerebral arteries","I633","VASCULAR","NS","Deran Sarafian","Lawrence Kaplow",13640000,"20 Sep. 2005",9.2,4074,"A very brave and mature 9-year-old girl has terminal cancer, but that is not what the problem seems to be."
"40",2,3,25,"Humpty Dumpty","Alfredo","Chlamydia psittaci infection","A70","INFECTIOUS","UG","Dan Attias","Matt Witten",13370000,"27 Sep. 2005",8,2507,"Cuddy joins the team after her handyman falls off of her roof and begins to develop bizarre symptoms. Clinic Cases: African American man who objects to ""minority meds."""
"41",2,4,26,"TB or Not TB","Dr. Sebastian Charles","Benign neoplasm: Endocrine pancreas","D137","NEOPLASTIC","PANCREAS","Peter O'Fallon","David Foster",12180000,"1 Nov. 2005",8.1,2526,"A doctor campaigns against the epidemic of TB in Africa, possibly at the risk of his own life."
"42",2,5,27,"Daddy's Boy","Carnell Hall","Haemangioma, any site","D180","NEOPLASTIC","BONE MARROW","Greg Yaitanes","Thomas L. Moran",14150000,"8 Nov. 2005",8.1,2476,"The team takes care of a student with inexplicable electrical shocks, and House's parents visit."
"43",2,6,28,"Spin","Jeff Forster","Myasthenia gravis","G700","AUTOIMMUNE","NS","Fred Gerber","Sara Hess",12950000,"15 Nov. 2005",7.9,2409,"Star bicycle racer collapses, and the team must come up with a diagnosis after the patient admits to blood doping. House and Stacy continue sparring with each other. Clinic Case: Flight attendant poisons himself with gum."
"44",2,6,28,"Spin","Jeff Forster","Myasthenia gravis","G700","NEUROLOGIC","NS","Fred Gerber","Sara Hess",12950000,"15 Nov. 2005",7.9,2409,"Star bicycle racer collapses, and the team must come up with a diagnosis after the patient admits to blood doping. House and Stacy continue sparring with each other. Clinic Case: Flight attendant poisons himself with gum."
"45",2,6,28,"Spin","Jeff Forster","Chronic acquired pure red cell aplasia","D600","NEOPLASTIC","BONE MARROW","Fred Gerber","Sara Hess",12950000,"15 Nov. 2005",7.9,2409,"Star bicycle racer collapses, and the team must come up with a diagnosis after the patient admits to blood doping. House and Stacy continue sparring with each other. Clinic Case: Flight attendant poisons himself with gum."
"46",2,6,28,"Spin","Jeff Forster","Malignant neoplasm of thymus","C37","NEOPLASTIC","THYMUS","Fred Gerber","Sara Hess",12950000,"15 Nov. 2005",7.9,2409,"Star bicycle racer collapses, and the team must come up with a diagnosis after the patient admits to blood doping. House and Stacy continue sparring with each other. Clinic Case: Flight attendant poisons himself with gum."
"47",2,7,29,"Hunting","Kalvin Ryan","Echinococcosis","B67","INFECTIOUS","liver","Gloria Muzio","Liz Friedman",14720000,"22 Nov. 2005",8.3,2468,"After being accused of assaulting a sick man, House is forced to take on his case. However, despite the fact that he has AIDS, it's clearly not what's killing him."
"48",2,8,30,"The Mistake","Kayla McGinley","Gastric ulcer","K25","GASTRO","GI","David Semel","Peter Blake",14910000,"29 Nov. 2005",8.9,2872,"Chaos ensues after Chase's negligence leads to the death of a female patient. Now, after an inquiry from the hospital board, and a subpoena from the patient's brother, it's up to Stacey to protect Chase's career, as well as House's."
"49",2,8,30,"The Mistake","Kayla McGinley","Behçet disease","M352","CONNECTIVE",NA,"David Semel","Peter Blake",14910000,"29 Nov. 2005",8.9,2872,"Chaos ensues after Chase's negligence leads to the death of a female patient. Now, after an inquiry from the hospital board, and a subpoena from the patient's brother, it's up to Stacey to protect Chase's career, as well as House's."
"50",2,8,30,"The Mistake","Kayla McGinley","Sepsis due to other Gram-negative organisms","A415","INFECTIOUS","BV, NS, LIVER, REN","David Semel","Peter Blake",14910000,"29 Nov. 2005",8.9,2872,"Chaos ensues after Chase's negligence leads to the death of a female patient. Now, after an inquiry from the hospital board, and a subpoena from the patient's brother, it's up to Stacey to protect Chase's career, as well as House's."
"51",2,8,30,"The Mistake","Kayla McGinley","Infarction of liver","K763","GASTRO","liver","David Semel","Peter Blake",14910000,"29 Nov. 2005",8.9,2872,"Chaos ensues after Chase's negligence leads to the death of a female patient. Now, after an inquiry from the hospital board, and a subpoena from the patient's brother, it's up to Stacey to protect Chase's career, as well as House's."
"52",2,8,30,"The Mistake","Kayla McGinley","Malignant neoplasm: Liver cell carcinoma","C220","NEOPLASTIC","liver","David Semel","Peter Blake",14910000,"29 Nov. 2005",8.9,2872,"Chaos ensues after Chase's negligence leads to the death of a female patient. Now, after an inquiry from the hospital board, and a subpoena from the patient's brother, it's up to Stacey to protect Chase's career, as well as House's."
"53",2,9,31,"Deception","Anica Jovanovich","Foodborne Clostridium perfringens [Clostridium welchii] intoxication","A052","INFECTIOUS","GI","Deran Sarafian","Michael R. Perry",14520000,"13 Dec. 2005",8.5,2425,"A woman collapses at an off-track betting parlor in front of House, and he must battle his new boss to find her diagnosis."
"54",2,9,31,"Deception","Anica Jovanovich","Intentional production or feigning of symptoms or disabilities, either physical or psychological [factitious disorder]","F681","PSYCHIATRIC","NS","Deran Sarafian","Michael R. Perry",14520000,"13 Dec. 2005",8.5,2425,"A woman collapses at an off-track betting parlor in front of House, and he must battle his new boss to find her diagnosis."
"55",2,10,32,"Failure to Communicate","Fletcher Stone","Plasmodium falciparum malaria with cerebral complications","B500","INFECTIOUS","NS, BV","Jace Alexander","Doris Egan",14830000,"10 Jan. 2006",8.6,2486,"When a famous writer is brought in with language difficulties, House must assist via phone while waiting for a delayed plane."
"56",2,11,33,"Need to Know","Margo Dalton","Malignant neoplasm: Other specified carcinomas of liver","C227","NEOPLASTIC","liver","David Semel","Pamela Davis",22240000,"7 Feb. 2006",8.2,2372,"House and the team must determine what is causing an increasingly deceitful patient's muscle flailing. Stacy makes a decision, and Cameron avoids a test."
"57",2,12,34,"Distractions","Adam","Poisoning: Other and unspecified antidepressants","T432","PSYCHIATRIC","NS, LIVER","Dan Attias","Lawrence Kaplow",19200000,"14 Feb. 2006",8.6,2467,"A patient with 40% body burns and inexplicable cardiac and neurological signs is treated by the team, while House pursues disproving an old enemy's medical study."
"58",2,13,35,"Skin Deep","Alex","Malignant neoplasm: Descended testis","C621","NEOPLASTIC","UG","Jim Hayman","Story by: Russel Friend & Garrett LernerTeleplay by: Russel Friend & Garrett Lerner & David Shore",14180000,"20 Feb. 2006",8.7,2742,"The search for the cause of a supermodel's symptoms causes intense feelings among the team, as new facts are revealed. Meanwhile, House experiences increasing pain in his leg."
"59",2,14,36,"Sex Kills","Howard Hesseman","Brucellosis","A23","INFECTIOUS","UG","David Semel","Matt Witten",20560000,"7 Mar. 2006",8.4,2440,"House and the team struggle to diagnose one patient in order to save another. Clinic Case: College student claims he has the hots for heifers."
"60",2,15,37,"Clueless","Bob Palko","Toxic effect of metals","T56","METABOLIC","LIVER, BV","Deran Sarafian","Thomas L. Moran",21440000,"28 Mar. 2006",8.5,2415,"House must diagnose a man who became sick and experienced difficulty breathing during sex-play but all tests keep returning normal. Wilson experiences close-up what living with House is like. Clinic case: Herpes"
"61",2,16,38,"Safe","Melinda Bardach","Tick-borne viral encephalitis","A84","INFECTIOUS","NS","Félix Alcalá","Peter Blake",22710000,"4 Apr. 2006",8.8,2682,"6 months after a teenage girl crushes her chest in a car accident and receives a heart transplant she goes into anaphylactic shock in her clean room bedroom after her boyfriend almost kisses her and discovers something on her arm."
"62",2,17,39,"All In","Ian Alston","Malignant histiocytosis","C961","NEOPLASTIC","SKIN","Fred Gerber","David Foster",21200000,"11 Apr. 2006",9,3075,"On a class field trip, a teacher discovers that her six-year-old student, Ian, is bleeding profusely. Dr. House thinks Ian has the same unknown disease that killed an elderly patient of his years ago."
"63",2,18,40,"Sleeping Dogs Lie","Hannah","Bubonic plague","A200","INFECTIOUS","LYMPH NODES","Greg Yaitanes","Sara Hess",22640000,"18 Apr. 2006",8.2,2359,"Cameron gets mad at Foreman because Foreman steals his idea for an article. The case of the week: a lesbian woman has not slept for ten days despite taking a bottle of sleeping pills."
"64",2,19,41,"House vs. God","Boyd","Tuberous sclerosis","Q851","OBSGYN","LUNGS, REN","John F. Showalter","Doris Egan",24520000,"25 Apr. 2006",8.6,2680,"House takes on a teenage faith healer, Wilson desperately wants into a poker game, and tensions escalate between Cameron and Foreman."
"65",2,19,41,"House vs. God","Boyd","Herpesviral encephalitis","B004","INFECTIOUS","NS","John F. Showalter","Doris Egan",24520000,"25 Apr. 2006",8.6,2680,"House takes on a teenage faith healer, Wilson desperately wants into a poker game, and tensions escalate between Cameron and Foreman."
"66",2,20,42,"Euphoria: Part 1","Joe Luria","Legionnaires disease","A481","INFECTIOUS","LUNGS","Deran Sarafian","Matthew V. Lewis",22710000,"2 May 2006",9.1,3311,"A police officer in critical condition has bizarre symptoms, and Dr. Foreman finds himself in an unpleasant situation."
"67",2,21,43,"Euphoria: Part 2","Eric Foreman","Legionnaires disease","A481","INFECTIOUS","LUNGS","Deran Sarafian","Russel Friend & Garrett Lerner & David Shore",17160000,"3 May 2006",9.3,3642,"House tries radical procedures to save Foreman's life. Foreman's father visits."
"68",2,21,43,"Euphoria: Part 2","Eric Foreman","Naegleriasis","B602","INFECTIOUS","NS","Deran Sarafian","Russel Friend & Garrett Lerner & David Shore",17160000,"3 May 2006",9.3,3642,"House tries radical procedures to save Foreman's life. Foreman's father visits."
"69",2,22,44,"Forever","Kara Mason","Deficiency of vitamin K","E561","NUTRITION","BV, BONES","Daniel Sackheim","Liz Friedman",24290000,"9 May 2006",8.1,2305,"A dad kisses his wife and baby goodbye before leaving for work, pukes and returns to find his wife with seizure in the bathtub and the baby under water. Foreman is back but changed."
"70",2,22,44,"Forever","Kara Mason","Deficiency of vitamin K","E561","NUTRITION","BV","Daniel Sackheim","Liz Friedman",24290000,"9 May 2006",8.1,2305,"A dad kisses his wife and baby goodbye before leaving for work, pukes and returns to find his wife with seizure in the bathtub and the baby under water. Foreman is back but changed."
"71",2,22,44,"Forever","Kara Mason","Coeliac disease","K900","AUTOIMMUNE","GI","Daniel Sackheim","Liz Friedman",24290000,"9 May 2006",8.1,2305,"A dad kisses his wife and baby goodbye before leaving for work, pukes and returns to find his wife with seizure in the bathtub and the baby under water. Foreman is back but changed."
"72",2,22,44,"Forever","Kara Mason","Coeliac disease","K900","GASTRO","GI","Daniel Sackheim","Liz Friedman",24290000,"9 May 2006",8.1,2305,"A dad kisses his wife and baby goodbye before leaving for work, pukes and returns to find his wife with seizure in the bathtub and the baby under water. Foreman is back but changed."
