"","season","episode_num_in_season","episode_num_overall","Episode","patients_name","medical_diagnosis","icd_code","category","organs_affected","directed_by","written_by","us_viewers","original_air_date","imdb_rating","total_votes","description"
"139",5,5,91,"Lucky Thirteen","Spencer","Sicca syndrome [Sjögren]","M350","CONNECTIVE",NA,"Greg Yaitanes","Liz Friedman & Sara Hess",13080000,"21 Oct. 2008",8.5,2365,"Thirteen's one night stand collapses at her apartment, and her symptoms are so misleading that the diagnosis may be terminal. Meanwhile, revelation about Wilson and Thirteen occupy House."
"140",5,6,92,"Joy","Jerry Harmon","Non-neuropathic heredofamilial amyloidosis","E850","METABOLIC","NS","Deran Sarafian","David Hoselton",13490000,"28 Oct. 2008",8.6,2277,"House takes on a case where the patient has unexplained blackouts, and his daughter may hold the key to the diagnosis. Meanwhile, Cuddy prepares for her new arrival until there are complications with the birth mother."
"141",5,6,92,"Joy","Samantha Harmon","Non-neuropathic heredofamilial amyloidosis","E850","METABOLIC","NS","Deran Sarafian","David Hoselton",13490000,"28 Oct. 2008",8.6,2277,"House takes on a case where the patient has unexplained blackouts, and his daughter may hold the key to the diagnosis. Meanwhile, Cuddy prepares for her new arrival until there are complications with the birth mother."
"142",5,7,93,"The Itch","Stewart Nozick","Toxic effect: Lead and its compounds","T560","METABOLIC","LIVER, BV, REN","Greg Yaitanes","Peter Blake",13060000,"11 Nov. 2008",8.2,2060,"House takes time to dabble in Cameron and Chase's love life while he treats an agoraphobic patient she's brought to the team."
"143",5,8,94,"Emancipation","Sophia Isabel Velez","Acute promyelocytic leukaemia [PML]","C924","NEOPLASTIC","BONE MARROW","Jim Hayman","Pamela Davis & Leonard Dick",13260000,"18 Nov. 2008",8,1980,"The team tries to treat a patient who keeps lying to them, and Foreman exerts some independence."
"144",5,8,94,"Emancipation","Jonah","Poisoning: Iron and its compounds","T454","METABOLIC","LIVER, BV","Jim Hayman","Pamela Davis & Leonard Dick",13260000,"18 Nov. 2008",8,1980,"The team tries to treat a patient who keeps lying to them, and Foreman exerts some independence."
"145",5,9,95,"Last Resort","Jason","Subacute and chronic melioidosis","A242","INFECTIOUS","SPLEEN","Katie Jacobs","Story by: Matthew V. LewisTeleplay by: Matthew V. Lewis & Eli Attie",12870000,"25 Nov. 2008",8.9,2937,"A person takes House, Thirteen and others as hostages. He's seen several doctors but none have found what ails him. As they work towards finding a solution, Thirteen makes decisions which leads her to think about her own condition."
"146",5,10,96,"Let Them Eat Cake","Emmy","Other porphyria","E802","METABOLIC","SKIN","Deran Sarafian","Russel Friend & Garrett Lerner",12510000,"2 Dec. 2008",8.2,2047,"The drug trial brings back memories for Thirteen; Kutner and Taub scramble as they try to salvage a scam and save the team's patient whose gastric bypass may not have saved her life."
"147",5,11,97,"Joy to the World","Natalie Soellner","Eclampsia","O15","OBSGYN","REN, LIVER, HEART, LUNG","David Straiton","Peter Blake",14050000,"9 Dec. 2008",8.4,2259,"A teenager collapses on stage, and the outcome will lead to a surprise for Cuddy. Wilson convinces House to be nice to his patients during the holidays. Foreman and Thirteen have issues when a trial patient drops from the program."
"148",5,12,98,"Painless","Jeff","Other generalized epilepsy and epileptic syndromes","G404","NEUROLOGIC","NS","Andrew Bernstein","Thomas L. Moran & Eli Attie",15020000,"19 Jan. 2009",8.1,2023,"House treats a patient who's worn out by chronic pain. Cuddy tries to do her job and take care of her new child. Foreman and Thirteen's relationship stalls."
"149",5,13,99,"Big Baby","Sarah","Patent ductus arteriosus","Q250","OBSGYN","BV","Deran Sarafian","Lawrence Kaplow & David Foster",15690000,"26 Jan. 2009",8,1931,"House maneuvers against a measured Cameron when she takes over Cuddy's duties, Foreman faces an ethical dilemma, and Cuddy has trouble bonding with the baby."
"150",5,13,99,"Big Baby","Sarah","Patent ductus arteriosus","Q250","OBSGYN","VASCULAR","Deran Sarafian","Lawrence Kaplow & David Foster",15690000,"26 Jan. 2009",8,1931,"House maneuvers against a measured Cameron when she takes over Cuddy's duties, Foreman faces an ethical dilemma, and Cuddy has trouble bonding with the baby."
"151",5,14,100,"The Greater Good","Dana Miller","Other endometriosis","N808","GENITOURINARY","UG","Lesli Linka Glatter","Sara Hess",14870000,"2 Feb. 2009",8,1932,"A physician who gave up her career comes in for treatment, leading to tense encounters with the team. Meanwhile, Cuddy exacts revenge and Foreman's choice has devastating consequences."
"152",5,15,101,"Unfaithful","Daniel Bresson","Wiskott-Aldrich syndrome","D820","AUTOIMMUNE","LYMPH NODE","Greg Yaitanes","David Hoselton",14190000,"16 Feb. 2009",8.4,2139,"House treats a priest who's lost his faith, issues an ultimatum to Foreman and Thirteen, and plays with Cuddy's desire to have him attend - or is it not attend? - her baby's naming ceremony."
"153",5,16,102,"The Softer Side","Jackson Smith","Nephropathy induced by other drugs, medicaments and biological substances","N141","GENITOURINARY","NS","Deran Sarafian","Liz Friedman",14850000,"23 Feb. 2009",8.5,2156,"House's team resents being made complicit in a web of lies parents have told their son when he's brought in for treatment that may be related to his intersexuality. Meanwhile, no one's content that House is happy."
"154",5,17,103,"The Social Contract","Nick Greenwald","Potter syndrome","Q606","OBSGYN","REN","Andrew Bernstein","Doris Egan",12380000,"9 Mar. 2009",8.7,2239,"The team tries to diagnose a condition that leaves the patient saying anything that he thinks, no matter whom it hurts, and Wilson raises House's antennae when he passes up a monster truck rally."
"155",5,18,104,"Here Kitty","Morgan West","Malignant neoplasm: Appendix","C181","NEOPLASTIC","GI","Juan J. Campanella","Peter Blake",13130000,"16 Mar. 2009",8.2,2088,"House treats a patient who is convinced she's dying because of a death predicting cat. Meanwhile Taub catches up with an old High School classmate and contemplates leaving the team."
"156",5,19,105,"Locked In","Lee","Leptospirosis","A27","INFECTIOUS","REN","Dan Attias","Russel Friend & Garrett Lerner & David Foster",12510000,"30 Mar. 2009",9.1,3290,"House is injured in a motorcycle accident. While recovering, he finds an accident victim suffering from a brain injury. House tries to prove the brain damage caused the accident, not vice versa, so he can treat the patient."
"157",5,19,105,"Locked In","Lee","Locked-in syndrome","G835","PSYCHIATRIC","NS","Dan Attias","Russel Friend & Garrett Lerner & David Foster",12510000,"30 Mar. 2009",9.1,3290,"House is injured in a motorcycle accident. While recovering, he finds an accident victim suffering from a brain injury. House tries to prove the brain damage caused the accident, not vice versa, so he can treat the patient."
"158",5,20,106,"Simple Explanation","Charlotte Novack","Visceral leishmaniasis","B550","INFECTIOUS","BV","Greg Yaitanes","Leonard Dick",13290000,"6 Apr. 2009",9.2,3534,"Taub treats a patient whose dying husband gets better as she becomes sicker, while the rest of the team deals with a devastating loss."
"159",5,20,106,"Simple Explanation","Eddie Novack","Blastomycosis","B40","INFECTIOUS","LUNGS","Greg Yaitanes","Leonard Dick",13290000,"6 Apr. 2009",9.2,3534,"Taub treats a patient whose dying husband gets better as she becomes sicker, while the rest of the team deals with a devastating loss."
"160",5,21,107,"Saviors","Doug Svensen","Sporotrichosis","B42","INFECTIOUS","SKIN","Matthew Penn","Eli Attie & Thomas L. Moran",12190000,"13 Apr. 2009",8.4,2106,"House worries he's lost his mojo when he can't determine the reason for Cameron and Wilson's changed behaviors or his new patient's diagnosis."
"161",5,22,108,"House Divided","Seth Miller","Sarcoidosis","D86","AUTOIMMUNE","LUNG","Greg Yaitanes","Liz Friedman & Matthew V. Lewis",11690000,"27 Apr. 2009",9.1,2816,"House's Amber hallucination becomes more aggressive as sleep deprivation takes its toll endangering a patient, and Chase's bachelor party ends in the emergency room."
"162",5,23,109,"Under My Skin","House","Mental and behavioural disorders due to use of opioids","F11","PSYCHIATRIC","NS","David Straiton","Lawrence Kaplow & Pamela Davis",12040000,"4 May 2009",9.2,3002,"When all of House's efforts to rid himself of Amber fail, he turns to someone unexpected for assistance. Meanwhile, the team is left to fend for itself as they try to save a ballerina's life and career."
"163",5,23,109,"Under My Skin","Penelope","Gonococcal infection","A54","INFECTIOUS","UG","David Straiton","Lawrence Kaplow & Pamela Davis",12040000,"4 May 2009",9.2,3002,"When all of House's efforts to rid himself of Amber fail, he turns to someone unexpected for assistance. Meanwhile, the team is left to fend for itself as they try to save a ballerina's life and career."
"164",5,24,110,"Both Sides Now","Scott","Toxic effect: Glycols","T523","METABOLIC","liver","Greg Yaitanes","Doris Egan",12740000,"11 May 2009",9.6,4968,"House and his team treat a patient who had his brain split in half, now it seems like one side of his brain is causing some health/behavioral issues. House plays games with Cuddy over the night he detoxed, and those events will cause major changes. Cameron and Chase come to a decision."
"165",5,24,110,"Both Sides Now","Eugene Schwartz","Malignant neoplasm of pancreas","C25","NEOPLASTIC","PANCREAS","Greg Yaitanes","Doris Egan",12740000,"11 May 2009",9.6,4968,"House and his team treat a patient who had his brain split in half, now it seems like one side of his brain is causing some health/behavioral issues. House plays games with Cuddy over the night he detoxed, and those events will cause major changes. Cameron and Chase come to a decision."
"166",5,24,110,"Both Sides Now","House","Unspecified nonorganic psychosis","F29","PSYCHIATRIC","NS","Greg Yaitanes","Doris Egan",12740000,"11 May 2009",9.6,4968,"House and his team treat a patient who had his brain split in half, now it seems like one side of his brain is causing some health/behavioral issues. House plays games with Cuddy over the night he detoxed, and those events will cause major changes. Cameron and Chase come to a decision."
"167",6,3,113,"Epic Fail","Vince Pearson","Other sphingolipidosis","E752","METABOLIC","BV","Greg Yaitanes","Sara Hess & Liz Friedman",14440000,"28 Sep. 2009",8.6,2424,"Vince hallucinates during testing of a video game, he's developing. House quits his old job after mental hospital. He joins Wilson in cooking class. Foreman takes over on trial."
"168",6,4,114,"The Tyrant","President Dibala","Blastomycosis","B40","INFECTIOUS","LUNGS","David Straiton","Peter Blake",13740000,"5 Oct. 2009",9,2761,"Foreman hires Chase and Cameron as his new team. An African tyrant becomes Foreman and co.'s patient. They're not happy. House is back as consultant. House meets Wilson's downstairs neighbor."
"169",6,4,114,"The Tyrant","Murphy","Phantom limb syndrome with pain","G546","NEUROLOGIC","NS","David Straiton","Peter Blake",13740000,"5 Oct. 2009",9,2761,"Foreman hires Chase and Cameron as his new team. An African tyrant becomes Foreman and co.'s patient. They're not happy. House is back as consultant. House meets Wilson's downstairs neighbor."
"170",6,5,115,"Instant Karma","Jack Randall","Other thrombophilia","D686","VASCULAR","BV","Greg Yaitanes","Thomas L. Moran",13500000,"12 Oct. 2009",8.5,2084,"A wealthy businessman brings his teenage son, who is suffering from inexplicable stomach pains, to Princeton Plainsboro and insists on having Dr. House handle the case. The father of the patient believes the karmic penalty of his financial success is that he is victim to personal tragedy, and that the answer to his son's medical mystery lies in a reverse of fate rather than medical treatment. Meanwhile, Foreman and Chase prepare to present information on the Dibala case."
"171",6,6,116,"Brave Heart","Donny Compson","Cerebral aneurysm, nonruptured","I671","VASCULAR","NS","Matt Shakman","Lawrence Kaplow",11650000,"19 Oct. 2009",8.5,2070,"A cop believes, he's genetically doomed to die of heart failure at 40 (next week), so he takes big risks at work, landing him with Cameron. She gets House to look at him."
"172",6,7,117,"Known Unknowns","Jordan","Disorders of iron metabolism","E831","METABOLIC","LIVER, BV","Greg Yaitanes","Matthew V. Lewis & Doris Egan",13310000,"9 Nov. 2009",8.3,2043,"A teenage girl is brought to the hospital with severely swollen appendages after a wild night out."
"173",6,7,117,"Known Unknowns","Jordan","Vibrio vulnificus as the cause of diseases classified to other chapters","B981","INFECTIOUS","GI","Greg Yaitanes","Matthew V. Lewis & Doris Egan",13310000,"9 Nov. 2009",8.3,2043,"A teenage girl is brought to the hospital with severely swollen appendages after a wild night out."
"174",6,8,118,"Teamwork","Hank Hardwick","Crohn disease [regional enteritis]","K50","AUTOIMMUNE","GI","David Straiton","Eli Attie",12670000,"16 Nov. 2009",8.2,2038,"After House's medical license is reinstated, he reclaims his role as Head of Diagnostics in time to treat Hank Hardwick, an adult film star admitted to Princeton Plainsboro for pulsating eye pain. Meanwhile, Cuddy is reminded that the hospial is not conducive to healthy personal relationships, and House angles to form a dream team."
"175",6,8,118,"Teamwork","Hank Hardwick","Crohn disease [regional enteritis]","K50","GASTRO","GI","David Straiton","Eli Attie",12670000,"16 Nov. 2009",8.2,2038,"After House's medical license is reinstated, he reclaims his role as Head of Diagnostics in time to treat Hank Hardwick, an adult film star admitted to Princeton Plainsboro for pulsating eye pain. Meanwhile, Cuddy is reminded that the hospial is not conducive to healthy personal relationships, and House angles to form a dream team."
"176",6,9,119,"Ignorance Is Bliss","James Sidas","Congenital malformations of spleen","Q890","OBSGYN","SPLEEN","Greg Yaitanes","David Hoselton",11950000,"23 Nov. 2009",8.3,2012,"A man with IQ 178 works as courier and collapses in a bookstore. House is still playing his games for Cuddy's attention. Chase punches him."
"177",6,9,119,"Ignorance Is Bliss","James Sidas","Thrombotic microangiopathy","M311","CONNECTIVE","BV","Greg Yaitanes","David Hoselton",11950000,"23 Nov. 2009",8.3,2012,"A man with IQ 178 works as courier and collapses in a bookstore. House is still playing his games for Cuddy's attention. Chase punches him."
"178",6,10,120,"Wilson","Tucker","Acute lymphoblastic leukaemia [ALL]","C910","NEOPLASTIC","BONE MARROW","Lesli Linka Glatter","David Foster",13240000,"30 Nov. 2009",8.9,2620,"When an old friend and former patient of Wilson's experiences paralysis in his right arm, Wilson puts himself on the case. House wagers Wilson that the patient's symptoms result from new cancer cells. Wilson accepts even though he is reluctant to believe the cancer has returned. With the help of the team, Wilson works to find a more optimistic diagnosis, but when things take a turn for the worse, and Wilson must address his inability to separate patient from friend. Meanwhile, Cuddy seeks advice in her search for real estate."
"179",6,11,121,"The Down Low","Mickey","Other specified diseases of pulmonary vessels","I288","VASCULAR","BV, LUNGS","Nick Gomez","Sara Hess & Liz Friedman",12250000,"11 Jan. 2010",8.9,2558,"When drug dealer Mickey mysteriously collapses while negotiating a sale, his partner-in-crime, Eddie, accompanies him to Princeton Plainsboro for treatment. But with a major deal pending, Mickey is not forthcoming with the necessary personal information the team needs to treat him. As Mickey's condition worsens, the team resorts to old-fashioned detective work to solve the case. Meanwhile, House and Wilson compete for the affection of a new neighbor, and Chase, Thirteen and Taub attempt to play a practical joke on Foreman."
"180",6,12,122,"Remorse","Valerie","Specific personality disorders","F60","PSYCHIATRIC","NS","Andrew Bernstein","Peter Blake",14210000,"25 Jan. 2010",8.7,2202,"The team takes on the case of Valerie, an attractive female executive experiencing random episodes of excruciating pain. House agrees to take the case based on Valerie's looks, and while treating her, the men on the team are charmed by Valerie's beauty and personality, with Thirteen looking beyond the superficial to try to discover a link to her illness. Meanwhile, House uncharacteristically attempts to alleviate his conscience by reaching out to a former medical school colleague he wronged."
"181",6,12,122,"Remorse","Valerie","Disorders of copper metabolism","E830","METABOLIC","liver","Andrew Bernstein","Peter Blake",14210000,"25 Jan. 2010",8.7,2202,"The team takes on the case of Valerie, an attractive female executive experiencing random episodes of excruciating pain. House agrees to take the case based on Valerie's looks, and while treating her, the men on the team are charmed by Valerie's beauty and personality, with Thirteen looking beyond the superficial to try to discover a link to her illness. Meanwhile, House uncharacteristically attempts to alleviate his conscience by reaching out to a former medical school colleague he wronged."
"182",6,13,123,"Moving the Chains","Daryl","Melanoma in situ, unspecified","D039","NEOPLASTIC","SKIN","David Straiton","Russel Friend & Garrett Lerner",13380000,"1 Feb. 2010",8,1922,"House and the team rush to treat an ailing college football star in time for the patient to compete in NFL tryouts. But when the patient experiences an onslaught of varied and unusual symptoms, the team has trouble reaching a consensus on how to effectively treat him in time. Meanwhile, Foreman's brother Marcus makes a surprise visit to the hospital."
"183",6,13,123,"Moving the Chains","Daryl","Paraneoplastic neuromyopathy and neuropathy","G130","NEUROLOGIC","NS","David Straiton","Russel Friend & Garrett Lerner",13380000,"1 Feb. 2010",8,1922,"House and the team rush to treat an ailing college football star in time for the patient to compete in NFL tryouts. But when the patient experiences an onslaught of varied and unusual symptoms, the team has trouble reaching a consensus on how to effectively treat him in time. Meanwhile, Foreman's brother Marcus makes a surprise visit to the hospital."
"184",6,15,125,"Private Lives","Frankie","Other intestinal malabsorption","K908","GASTRO","GI","Sanford Bookstaver","Doris Egan",12810000,"8 Mar. 2010",8,2016,"House and the team take on the case of an avid blogger admitted with sudden bruising and bleeding. From her hospital bed, the patient blogs about her symptoms, doctors and prospective diagnoses to her dedicated band of followers and solicits their advice on a course of treatment. Such openness leads the team to contemplate the value of privacy, especially after House and Wilson uncover secrets from one another's past. Meanwhile, Chase is coaxed into testing out the dating scene ."
"185",6,16,126,"Black Hole","Abby Nash","Schistosomiasis [bilharziasis]","B65","INFECTIOUS","BV","Greg Yaitanes","Lawrence Kaplow",11370000,"15 Mar. 2010",8,1967,"Physics student and his father, Artie, bring in the kid's lover Abby Nash, who nearly suffocated in foam during a planetarium lecture. The team eliminates everything except an allergy to something in her body. House presses Wilson to buy furniture as a way to express his personality."
"186",6,18,128,"Knight Fall","Sir William","Abuse of non-dependence-producing substances","F55","PSYCHIATRIC","liver","Juan J. Campanella","John C. Kelley",10810000,"19 Apr. 2010",7.9,1905,"At a renaissance festival, a knight fights for the princess's hand. He falls to the ground with red eyes but no wounds. Wilson dates his first ex-wife. House and 13 investigate dressed up at the renaissance festival."
"187",6,19,129,"Open and Shut","Julia","Allergic purpura","D690","ALLERGIC","SKIN","Greg Yaitanes","Liz Friedman & Sara Hess",10850000,"26 Apr. 2010",7.8,1876,"A woman in an open marriage suddenly gets strong belly pain. Taub would like an open marriage. Wilson's new relationship with his ex is shaky."
"188",6,20,130,"The Choice","Ted","Arnold-Chiari syndrome","Q070","OBSGYN","NS","Juan J. Campanella","David Hoselton",9980000,"3 May 2010",8.1,1946,"The team takes on the case of an ailing groom-to-be who harbors undisclosed secrets from a previous relationship. As his fiancée tries to get answers to her many questions, a frustrated team winnows down the possibilities. Meanwhile, House spends extra-curricular time with his Princeton Plainsboro colleagues, performing a karaoke rendition of a Gladys Knight & The Pips classic with Foreman and Chase."
"189",6,21,131,"Baggage","Sidney","Personal history of allergy, other than to drugs and biological substances","Z910","ALLERGIC","liver","David Straiton","Doris Egan & David Foster",9290000,"10 May 2010",8.9,2471,"At therapy with Dr. Nolan, House tells about a cute amnesiac in ER, Wilson throwing him out and his old apartment being a mess after Alvarez broke in."
"190",6,22,132,"Help Me","Hanna","Fat embolism (traumatic)","T791","VASCULAR","BV","Greg Yaitanes","Russel Friend & Garrett Lerner & Peter Blake",11060000,"17 May 2010",9.6,4522,"Cuddy, House and members of the team join forces with a search-and-rescue team to provide much-needed medical attention at the scene of an emergency."
"191",6,22,132,"Help Me","Jay","Cerebral cysts","G930","NEUROLOGIC","NS","Greg Yaitanes","Russel Friend & Garrett Lerner & Peter Blake",11060000,"17 May 2010",9.6,4522,"Cuddy, House and members of the team join forces with a search-and-rescue team to provide much-needed medical attention at the scene of an emergency."
"192",7,1,133,"Now What?","Dr. Richardson","Toxic effect: Toxic effect of contact with other marine animals","T636","METABOLIC","liver","Greg Yaitanes","Doris Egan",10540000,"20 Sep. 2010",8.3,2470,"House and Cuddy are exploring the ramifications of those feelings and attempting to make a real relationship work. Meanwhile, due to a colleague's illness, Princeton Plainsboro is left without a neurosurgeon on site, threatening the hospital's accreditation as a Level 1 Trauma Center. As the team attempts treatment to get their sick colleague back to work, they discover there is more to the illness than they originally suspected and turn to House for direction. Instead, House remains elusive, leaving the team on its own."
"193",7,2,134,"Selfish","Della","Sickle-cell trait","D573","VASCULAR","BV","Dan Attias","Eli Attie",10180000,"27 Sep. 2010",8.6,2166,"When Della, a seemingly healthy and active 14-year-old, suddenly collapses during a skateboarding exhibition, House and his team struggle to diagnose her condition and reassure her parents who already have to cope with their son's terminal illness. After her body rejects a donor lung, and with time running out to save her life, Della's family is left with little hope of securing a new donor and faced with a seemingly impossible decision regarding the fate of both children. Meanwhile, House tries to appease an elderly father and his son at the clinic, and House and ..."
"194",7,3,135,"Unwritten","Alice Tanner","Syringomyelia and syringobulbia","G950","NEUROLOGIC","NS","Greg Yaitanes","John C. Kelley",10780000,"4 Oct. 2010",8.3,1933,"A famous novelist finishes her last novel and gets ready to shoot herself, when she has a seizure. House gives her a 72 hour psych hold to find out what's wrong with her. House and Wilson go on a go-kart double-date."
"195",7,4,136,"Massage Therapy","Margaret McPherson","Schizophrenia","F20","PSYCHIATRIC","NS","David Straiton","Peter Blake",9690000,"11 Oct. 2010",7.9,1831,"When a patient named Margaret McPherson is admitted to Princeton Plainsboro after suffering severe and uncontrollable vomiting, House and the team make unexpected discoveries about her identity as they assess her symptoms. When the symptoms don't improve, the team looks to the patient's medical history to unearth more about her past. Meanwhile, House gives Chase's new hire a cold welcome, and a visit from House's massage therapist forces House and Cuddy to confront the reservations in their relationship."
"196",7,5,137,"Unplanned Parenthood","Abbey","Pulmonary embolism","I26","VASCULAR","LUNG","Greg Yaitanes","David Foster",9650000,"18 Oct. 2010",8.2,1918,"A newborn baby has problems breathing. House and team run diagnosis. House babysits Cuddy's daughter. Did she eat a dime? Foreman finds a new female doctor for the team. House fires her and Taub has to find a new one."
"197",7,5,137,"Unplanned Parenthood","Abbey","Secondary malignant neoplasm of lung","C780","NEOPLASTIC","LUNG","Greg Yaitanes","David Foster",9650000,"18 Oct. 2010",8.2,1918,"A newborn baby has problems breathing. House and team run diagnosis. House babysits Cuddy's daughter. Did she eat a dime? Foreman finds a new female doctor for the team. House fires her and Taub has to find a new one."
"198",7,5,137,"Unplanned Parenthood","Abbey","Malignant neoplasm: Malignant melanoma of upper limb, including shoulder","C436","NEOPLASTIC","SKIN","Greg Yaitanes","David Foster",9650000,"18 Oct. 2010",8.2,1918,"A newborn baby has problems breathing. House and team run diagnosis. House babysits Cuddy's daughter. Did she eat a dime? Foreman finds a new female doctor for the team. House fires her and Taub has to find a new one."
